audio_id,start_sec,end_sec,duration_sec,speaker,text,n_chars,n_words
QXxxl8ckqDY,3640.14,3664.14,24.0,SPEAKER_00,yo me voy a quedar con Jägor Thiago creo que lo que necesitaba es esperadamente el Benford en este verano en el que se ha ido Visa y en Beumo y me está gustando ya lejos de su relación con el gol su juego de espaldas y como está aportando esas soluciones que necesita el Benford en esos ataques directos creo que hay un buen delantero ahí que nos habíamos perdido con las lesiones el año pasado y vuelve a tener buen ojo el Benford,431,85
QXxxl8ckqDY,3664.14,3698.14,34.0,SPEAKER_01,a la hora de fichar ahí yo lo mejor para mí del Benford es algo que aprecio mucho en este tipo de equipos que han sido descapitalizados en cuanto a su talento que es ser muy consciente de sus virtudes y de sus defectos y eso es una cosa que me está gustando está priorizándose un equipo muy organizadito atrás muy directo en su juego y que además aprovecha las jugadas de estrategia para sacar el máximo está siendo pragmático dentro de lo que sabe que le puede pedir a su equipo y eso es algo que aunque quizá Andrés no me está maravillando con su futbol se aprecio porque creo que hay muchos entrenadores que con esta plantilla no estarían ahora mismo decimos sexto sino que estarían más abajo que es lo que nos ha gustado,724,137
QXxxl8ckqDY,3698.14,3720.14,22.0,SPEAKER_00,a mí la defensa del área creo que es el mayor bajonazo que ha tenido respecto al año pasado esa defensa de su propio área ahí eran más fuertes el año pasado y ahora están siendo menos contundentes no están ganando esas segundas jugadas que nos tienen acostumbrados a ganar en su propio área por esa acumulación creo que está habiendo muchos despistes y que es el mayor bajón que le noto al Brenford,398,74
QXxxl8ckqDY,3720.14,3734.14,14.0,SPEAKER_01,yo veo partidos que si me ha gustado al Brenford ahí con Izan Collins además me sigue gustando echan de menos el mejor nivel de Izan Pinoc pero dentro del talento defensivo que tienen no me ha parecido tan malo me parece que tienen errores,239,45
QXxxl8ckqDY,3734.14,3770.14,36.0,SPEAKER_00,también porque son un equipo al que le ataca mucho entonces es difícil estar siempre yo me quedo con la falta de minutos de Dango Watar solo ha sido titular en tres de los seis partidos en los que ha podido estar y por lo que has pagado y también por lo que has pagado y por lo que has demostrado Watar en algunos momentos en el Bormud espero que sea bastante más importante cuando ha jugado con línea de tres y dos carileros en los que han jugado arriba han sido Kevin Shade y Gortiago si cuando juegas con tres te cargas a Watar te va a faltar velocidad un poco de creatividad y sobre todo te vas a gastar 42 millones de euros en un suplente para mi sin duda lo malo de la temporada es Kevin Shade,699,140
QXxxl8ckqDY,3770.14,3816.14,46.0,SPEAKER_01,"hay que pedirle mucho más respecto a lo que hemos visto en el borde de la carrera pero me está pareciendo que deja mucho que desear en cuanto a su toma de decisiones su relación con Gortiago por mucho que haya tenido un par de momentos destacados Kevin Shade creo sobre todo en lo individual malos contactos con la pelota, mala toma de decisiones las cifras no están acompañando creo que lleva un gol, no mucho más pero creo que se nota el bajón del Brenford sobre todo en la figura de Shade respecto a la carrera de la temporada vamos con el 17 el Nottingham Forest rozamos la zona de descenso que es lo que os ha gustado es difícil elegir algo pero bueno, uno de los dos ha expuesto a este hombre así que que lo diga",718,139
QXxxl8ckqDY,3816.14,3892.14,76.0,SPEAKER_00,"yo porque fui el primero en elegir y creo que lo único que me ha gustado del forest en este inicio de temporada ha sido él está siendo un inicio pobre Eliot Anderson está siendo un inicio pobre está siendo un inicio pobre y creo que es el único jugador que no es que esté destacando sino brillando, a mi me está gustando muchísimo el inicio de temporada de León Anderson y que creo que está siendo ese líder que le pedía ser a Gates White este año otra vez no lo tenía muy fácil pero vuelvo a elegir un futbolista que creo que me gusta más que al resto no lo hemos hablado nunca, pero en general creo que se habla poco de Dánin Doge y a mi es un futbolista que me gusta el primer jugador que me gustó costó 40 o 50 millones pero a pesar de que no tiene mucho esborde porque el tío rápido no es me parece muy inteligente tácticamente que tiene además buena técnica y que sí que me lo imagino funcionando en un sistema de H-POSTE Koglú que pide que los futbolistas entiendan el futbol y sean inteligentes tácticamente entonces en el mejor o sea en el mejor, en el no tengan forest de H-POSTE Koglú el de... el top 3 de Nuno el top 1 de H-POSTE Koglú nos va a pasar mucho",1168,232
QXxxl8ckqDY,3892.14,3934.14,42.0,SPEAKER_01,"y es lógico, bueno yo por haber llegado el último a... estamos hablando de un equipo que venía a ser la gran revelación y ahora todos han bajado su nivel me he quedado con un futbolista que he visto muy poco pero que creo que tenía espacio para más oportunidades que es Jair Kuña el partido que hace contra el Newcastle me gustó mucho y los minutos que le he visto con la camiseta del forest creo que que se dedican a verlo más que ahora lo vamos a hablar supongo en lo malo pero sin Morillo perdón yo pensaba que Jair Kuña iba a tener algún hueco más visto que los minutos han sido de calidad Jesús ¿qué es lo que a ti más te ha gustado? nada, ya sabía yo en cuanto a lo malo",676,137
QXxxl8ckqDY,3934.14,3998.14,64.0,SPEAKER_00,"voy yo rápido porque ya lo has dicho sin Morillo se le han visto muchas costuras a Milenkovic, que el año pasado se salió pues sin Morillo se están viendo más problemas y ya no es que se le vean más problemas es que se está viendo que Morato es un central de defensa me está pareciendo horroroso Morato, entonces que no esté Jair Kuña, que no esté Morillo, la defensa no se sostiene y igual a final de temporada valoramos lo que pasó con Nuno la temporada pasada, creo que que no esté Morillo no es cualquier cosa, falta él verdaderamente bueno, yo me quiero quedar con Marinakis en lo que no me ha gustado creo que es el gran culpable de absolutamente todo con el pifostio que ha montado cargándose es verdad que coche la temporada más ilusionante en 30 años de Nottingham Forest se le ha cargado este hombre quitando a Nuno que bueno, pues creo que ha sido un tanto injusto con todo lo que te había dado en la jornada 2 y para dar un completo volantazo metiendo Anspostekoglu en una plantilla que viene de Nuno, o sea, no creo que se lo ha cargado todo él",1057,202
QXxxl8ckqDY,3998.14,4032.14,34.0,SPEAKER_01,"y hay algo más general como el ambiente la grada dividida a los pocos partidos de Anspostekoglu ya le están cantando que te van a echar por la mañana jugadores que según decían desde Inglaterra no estaban de acuerdo con la salida de Nuno Espíritu Santo peleas entre la directiva y el banquillo, nada de esto tendría que estar pasando en un año en el que el Nottingham Forest está jugando en Europa está viajando la afición del Nottingham Forest por el continente para ver a su equipo y el ambiente tiene que estar tan obvio, me parece triste tiene mucho que ver con Marinaquis pero es evidentemente lo que no me está",616,113
QXxxl8ckqDY,4032.14,4046.14,14.0,SPEAKER_00,y aquí también hay que echarle culpa a Edu porque ha llegado un nuevo equipo ha hecho un muy buen mercado de fichajes finalmente pero él es el culpable de que la relación con Nuno se haya roto y por ahí pasa mucho desde los males del Forest y Nuno se rompió por las dos partes,276,56
QXxxl8ckqDY,4046.14,4076.14,30.0,SPEAKER_01,"vamos a la zona de descenso, vamos con los tres últimos equipos, el 18o es el Burnley de Scott Parker y del guapísimo y el persona y el peruano y hombre en general más guapo del planeta que es lo que más os ha gustado no, espera, empiezo yo por el mío que me lo habéis dejado supongo Jadon Anthony 4 goles y una asistencia ya está, no hace falta decirme nada más son las mejores cifras en participaciones de Jadon Anthony en toda su carrera en Premier hemos tenido que llegar al descenso",487,94
QXxxl8ckqDY,4076.14,4106.14,30.000000000000455,SPEAKER_00,"para dejarte uno y Vierz también, y Tarkovsky se lo dejamos en el Leeds y en el Bournemouth tienen que estar alucinando con Jadon Anthony está siendo el mejor yo va a sonar un poco raro lo que voy a decir porque hablo de un equipo en descenso pero la competitividad del Burnley a pesar de haber perdido 5 partidos 3 de ellos han sido por la mínima y eso que han tenido un calendario muy difícil con 4 big 6, se han enfrentado ya al Tottenham al United, al Liverpool y al City además ganaron el duelo directo, el único que han tenido que fue contra el Sunderland así que este Burnley es competitivo y no es otro Southend",619,120
QXxxl8ckqDY,4106.14,4122.14,16.0,SPEAKER_01,y lo decíamos en el vídeo que subimos de los 3 recién ascendidos que los dos que te has dejado por mencionar son los dos otros equipos que están en Europa Aston Villa y Nottingham Forest quiero decir que el calendario ha sido muy feo para el Burnley y ahora lo mejor mejora esas prestaciones no como Liversony,309,58
QXxxl8ckqDY,4122.14,4146.14,24.0,SPEAKER_00,que recordamos que vuelve a ser el hombre más guapo del mundo y yo creo que al hilo de lo de la competitividad hay un nombre por encima de todos que está manteniendo al Burnley en muchos partidos que es Dubravka está siendo otra vez demostrando que es portero de Premier pese a que tiene 800.000 años y sigue parando como paranda y yo creo que es la gran clave de que el Burnley no se haya ido de muchos partidos,412,81
QXxxl8ckqDY,4146.14,4196.14,50.0,SPEAKER_01,"Yo en cuanto a lo malo me he quedado con la banda derecha, sobre todo enfocándome en Shauna, a mi Shauna no me dice absolutamente nada, es un jugador que no me convence nada de lo que estoy viendo él en el en los Clarets y a eso añado que Walker, cuyo rendimiento si me está gustando en el Burnley, no produce tanto como Harman por la izquierda, claro veo la banda izquierda y veo a Harman y veo a Anthony la banda derecha se me está quedando coja, creo que por ahí tiene todavía Scott Parker margen para agitar un poco la baraja se me ocurre que puede jugar Fleming a lo mejor por detrás del delantero, no necesariamente por la banda pero hecho en falta a lo mejor un poco más de participación de Saian Fleming, Edwards puede también jugar por esa demarcación que no va a marcar muchos goles porque está en punta Foster y si no cuando se recope creo que ahora mismo está lesionado Broya, pero esa banda derecha y sobre todo enfocado en Shauna",943,180
QXxxl8ckqDY,4196.14,4248.14,52.0,SPEAKER_00,"no me está gustando. Mi punto es algo más general y es la falta de ambición de ALK Capital, así que los acciones de español que nos estén escuchando ahora mismo se estarán cabreando porque ya sabéis que los dueños del Barley han comprado el español, se gastaron 93 millones en el mercado que puede parecer mucho pero no lo es, son los undécimos de la Premier League que han gasto neto teniendo en cuenta que Hanfris, Edwards y Anthony y Sean Fleming son todos fichajes que han hecho este año pero que ya estaban en plantilla el año pasado me parece que ALK Capital ve la plantilla y dice vamos a extender como unos campeones, pero el año que viene volveremos a extender es un poco Delia Smith con el Norwich, con la diferencia que Delia Smith era de Norwich y aficionada del Norwich y un emblema y ALK Capital es un fondo de inversión estadounidense, entonces con ALK Capital tienes todo lo malo de un fondo de inversión sin tener lo bueno de un fondo de inversión que es",971,181
QXxxl8ckqDY,4248.14,4252.14,4.0,SPEAKER_01,la pasta. El próximo verano amistoso contra el español,54,9
QXxxl8ckqDY,4252.14,4280.14,28.0,SPEAKER_00,"y a hostias. Una de las cosas en donde más ha metido... Que en GAL se queda puado Una de las cosas en las que más ha metido la pata es... que en pierda se queda chauna el centro del campo que yo creo que le falta toda la creatividad del mundo al centro del campo, o sea Hugo Chuko es un dolor y es que Calen no... Un dolor literal sí, sí, es un dolor es un dolor, es un dolor, no creo que es lo que más le coge al equipo que es el centro del campo que no te genera nada",469,104
QXxxl8ckqDY,4280.14,4310.14,30.0,SPEAKER_01,"Tengo confianza en Florentino Yo también. Sé que esto dicho aquí en España, en Madrid suena otra cosa pero Florentino Luis el centrocampista del Berlín creo que lo hemos visto muy poquito pero tengo confianza en que le de cosas al equipo. Ahora bien Josh Calen no creo que sea como para salvarte por sí mismo pero bueno, confío en lo que he visto de Florentino es de estos de, bueno, me subes el nivel hombre viene él, vefica",425,79
QXxxl8ckqDY,4310.14,4312.14,2.0,SPEAKER_00,es que yo le vi jugar contra el Barça el año pasado en Champions,64,14
QXxxl8ckqDY,4312.14,4324.14,12.0,SPEAKER_01,"y pensé que era un crack ahora estoy viendo que no lo tan crack Bueno, empieza a ser un reto sacar cosas buenas 19º, West Ham United El escudo Uno de vosotros ha elegido a este hombre",183,37
QXxxl8ckqDY,4324.14,4338.14,14.0,SPEAKER_00,"así que dispara Yo no he elegido a este hombre, pero sí he elegido a Crisencio, Summerville No, venía de un año muy complicado en Premier porque está siendo uno de los grandes protagonistas de este mundo",203,37
QXxxl8ckqDY,4338.14,4342.14,4.0,SPEAKER_01,¿Cómo hay que estar para que el nombre sea Crisencio Summerville?,65,11
QXxxl8ckqDY,4342.14,4354.14,12.0,SPEAKER_00,"Uno de los grandes protagonistas Creo que bueno, pues en un equipo que aparte de Bowen está viendo poco más pues por lo menos él está siendo algo protagonista y algo agitador dispara tú, a ver, ¿qué más?",203,38
QXxxl8ckqDY,4354.14,4372.14,18.0,SPEAKER_01,"Bueno, yo no tenía ninguna duda, me ha sorprendido que no lo hayas dicho, el Haji Diouf Bueno, sí, pues no he pensado en él Me parece que está jugando francamente bien que es un jugador al que hay que separar del mal rendimiento del West Ham United, aunque le recuerdo un cagadón, no me acuerdo contra qué equipo, pero comete",325,61
QXxxl8ckqDY,4372.14,4380.14,8.0,SPEAKER_00,"un cagadón terrible A mí me recuerdo como que le enfocara luego la cámara, ya con sus orejitas pequeñas tuviera cara de... Son orejas muy graciosas",147,26
QXxxl8ckqDY,4380.14,4402.14,22.0,SPEAKER_01,"las de Haji Diouf Son unas orejas muy músculas y muy soplillo pero lleva tres asistencias ya que ya solo el número bruto es increíble en este equipo y me gusta como carrilero, como lateral creo que es un futbolista tanto antes con Potter como ahora con Nuno va a dar buen rendimiento porque lo está dando, me parece lo mejor de este West Ham, ahora mismo en esa banda",367,70
QXxxl8ckqDY,4402.14,4430.14,28.0,SPEAKER_00,"Si me hubiera acordado, hubiera puesto las orejas del Haji Malik Diouf que no es una crítica, me parecen muy graciosas y muy divertidas, pero como no me he acordado de puesto, imagínate cómo estamos que se haya clarificado la situación de Lucas Paquetá que es una cosa que sucedió en agosto, pero bueno, que después de un año y medio arrastrando el tema de Paquetá y que él mentalmente reconociera que no podía jugar al 100% porque tenía miedo de la sanción, pues ya ha sido absuelto, se queda en el West Ham y bueno, pues esas son buenas noticias",547,101
QXxxl8ckqDY,4430.14,4432.14,2.0,SPEAKER_01,las cosas que hemos sacado buenas de el West Ham y United,57,12
QXxxl8ckqDY,4432.14,4434.14,2.0,SPEAKER_00,"el lateral izquierdo, Crisentius",32,4
QXxxl8ckqDY,4434.14,4440.14,6.0,SPEAKER_01,"a Mervín y que hayan absuelto a Paquetá es que ahora lo de Paquetá está más claro bueno, ahora a ver qué tal su futbol",118,25
QXxxl8ckqDY,4440.14,4442.14,2.0,SPEAKER_00,"claro, porque bien bien no está",31,6
QXxxl8ckqDY,4442.14,4446.14,4.0,SPEAKER_01,bueno y lo malo pues nada es como si un mago bien ponía un montón de cartas y te coge una,89,21
QXxxl8ckqDY,4446.14,4486.14,40.0,SPEAKER_00,"a ver no, no, empieza, empieza a mi por empezar por algún lado la dirección deportiva en general ha sido un cachondeo el centro de la defensa sigue siendo Kilmán ma-Bropanos no me están gustando absolutamente nada y eso son los buenos días, porque los malos no me está saliendo ahora eto-dibo que tampoco aporta absolutamente nada tampoco ha acertado los perfiles necesarios en el centro del campo yo lo de Mateo Fernández me lo tienen que explicar no, no, ni le veía nada especial en el Southampton, ni mucho menos le veo como la solución para los problemas que tiene el West Ham en el centro del campo, así que que yo creo que de hecho era lo que más necesitaba reforzar el equipo entonces, un desastre",704,128
QXxxl8ckqDY,4486.14,4496.14,10.0,SPEAKER_01,"eh, Mads Hermansen totalmente si, ya está, ya está, si has visto al West Ham sabes de lo que hablo y si no te pones highlights porque al ser portero vas a ver bastante",167,34
QXxxl8ckqDY,4496.14,4498.14,2.0,SPEAKER_00,de las mayores decepciones de lo que llevamos de inicio de previo,65,12
QXxxl8ckqDY,4498.14,4508.14,10.0,SPEAKER_01,"me gustó mucho, en el Leicester es un des- bueno un auténtico desastre por arriba, por abajo, en su portería ya está, ya está sentado en el banquillo y ya está Alfonso Areola como portero",187,35
QXxxl8ckqDY,4508.14,4552.14,44.0,SPEAKER_00,"desastre absoluto es un equipo sin identidad y sin alma y está desaprovechando unos mayores talentos que van a tener en su historia moderna como es Jarrod Bowen así es claro, ya está habiendo protestas contra David Sullivan y Karen Brady y son pocas, creo que tiene que haber más o sea, evidentemente la Conference League fue una alegría y mucha gente va a decir con Bowen ganamos en la Conference League pero creo que en 10 años la gente va a decir que teníamos a Jarrod Bowen que es uno de los mejores atacantes de la Premier League y si si ganamos la Conference League pero es que no conseguimos hacer 3 clasificaciones buenas seguidas en la Premier League creo que no son conscientes en el West Ham del futbolista que tienen por cierto, ahora que decimos esto",763,139
QXxxl8ckqDY,4552.14,4574.14,22.0,SPEAKER_01,"también creo que en el West Ham todo el mundo es consciente de lo que ha sido pero ahora que no está se valora más a una Mikael Antonio lo que sacaba en el ataque Mikael Antonio, adelante el solito, mientras veía muchos metros a Bowen diciendo tu ven que ya me apaño ahora que no está, como se nota lo que daba Mikael Antonio",325,65
QXxxl8ckqDY,4574.14,4588.14,14.0,SPEAKER_00,"jugador, cuando me preguntan que es un jugador de culto, Mikael Antonio y el West Ham con quien estaba entrenando, Brenford puede ser, no lo sé no, el Brenford me habría enterado yo creo con el Hercules bueno, vamos con el último",229,42
QXxxl8ckqDY,4588.14,4598.14,10.0,SPEAKER_01,"con el colista amigos con los Wolverhampton Wanderers, ahí los tenéis quien quiere empezar con lo malo de los Wolves pues yo lo he puesto",137,25
QXxxl8ckqDY,4598.14,4624.14,26.0,SPEAKER_00,"ah no, perdón, perdón como son colistas me salen yo le he puesto a Crazy, como lo que me está gustando, que tampoco se pueden rescatar te he quitado la acasio, Crazy yo he puesto a Crazy, he puesto a la locura el loquito Crazy el loquito Crazy el Crazy lo está haciendo bien en defensa desde que ha llegado loco, loco, suelto él pero bueno, yo me he querido quedar con rescatar por alguien, pues me ha sorprendido",413,79
QXxxl8ckqDY,4624.14,4650.14,26.0,SPEAKER_01,"yo he ido por ahí, a mí me está gustando la temporada de Santi Bueno y creo que buena parte de la salvación se debe construir con la pareja Crazy y Santi Bueno hostia, ha jugado, eh no, no, en las dos últimas jornadas, ha estado en el banquillo y yo me plantearía también, viendo cómo está el equipo tipo, línea de cuatro como está haciendo, con Bueno y con Crazy y deberían empezar a llegar los resultados porque esa pareja ha funcionado bien",443,84
QXxxl8ckqDY,4650.14,4662.14,12.0,SPEAKER_00,"no recuerdo su nombre, pero nuestro aficionado de los Wolves de Cabecer a la comunidad todos sus tweets son en contra de Aguadu cada vez que suplente lo celebra hombre, la temporada pasada fue el que salvó esa defensa",217,39
QXxxl8ckqDY,4662.14,4664.14,2.0,SPEAKER_01,"esta temporada no está bien, podía haber entrado en lo malo",59,11
QXxxl8ckqDY,4664.14,4684.14,20.0,SPEAKER_00,"tranquilo, si nos contestará mucho porque siempre lo haces y que ponte opinas de Aguadu, con respeto yo con lo que me quedo es que no hayan activado el botón del pánico y no hayan echado a Vitor Pereira, de hecho lejos de echarle lo han renovado, creo que Vitor Pereira es un entrenador que sin mucha floritura te puede permitir estar estable en la Premier League me gusta que digas esto, porque para mí",403,75
QXxxl8ckqDY,4684.14,4740.14,56.0,SPEAKER_01,"lo malo de los Wolves es Vitor Pereira no compro tiende a dejar demasiado talento en el banquillo para un equipo que creo que la fórmula actual no le está funcionando y dispone de buenos futbolistas para ser más proactivo para mí demasiados minutos para Munetzi en primer lugar y para Wang Yichang, muchísimos minutos para los jugadores así, me alegro ya de que Creechis se esté quedando en el puesto de central y no en el centro del campo, que quítalo de ahí por Dios y en general creo que es un equipo para tener un entrenador que una vez que ve que una aproximación más tradicional o más conservadora desde el once al partido, no le funciona usar las piezas que tienes vale que has estado también sin Stan Larson y que es fundamental y que ahora en cuanto ya acumule varios partidos va a ser tu estrella pero a mí me está desdicionando",838,156
QXxxl8ckqDY,4740.14,4802.14,62.0,SPEAKER_00,"Vitor Pereira. Es curioso porque mi punto negativo también me ha parecido pero sin la crítica de Vitor Pereira no me está gustando Vitor Pereira este año pero sí que confío en él y creo que era bueno no activar el botón del pánico, da mi primer punto porque mi punto negativo es que no están sabiendo vivir sin Kuña y creo que hay talento con Arias, con Fer López con Rodrigo Gómez, incluso con Munez Ibelegar, que también creo que son futbolistas útiles y por supuesto Larson más en el centro del campo con Jo Gómez y André tienes piezas de sobra ya no solo para salvarte cómodo, sino además para jugar mejor, eso sí que lo tengo que decir es un equipo que de repente se ha ido Kuña y ha desaparecido todo lo que ha pasado en ataque y ligado a eso va lo mío que es la absoluta dependencia que tienen de Stan Larson en ataque, es un equipo en el que no me creo por lo que he visto estos 7 partidos a nadie aportándole a Stan Larson o sea, se me está quedando muy corto yo en Arias, bueno a Fer López le hemos visto muy poco Tolvaro Kodare no te quiero ni contar lo que me parece creo que es un equipo que va a girar en torno a Stan Larson y ya",1143,230
QXxxl8ckqDY,4802.14,4852.14,50.0,SPEAKER_01,"te juro que Harokodare creo que es un tío que puede acabar siendo útil para los Wolves hombre, solo por la ayuda pero un tío que juegue con Stan Larson y en un equipo que funcione mejor pero por ejemplo en unos Wolves que tengan más talento para llevar la pelota al área rival Harokodare creo que te va a funcionar Harokodare es una secuoya al tío que no se me entienda mal pero de verdad creo que va a ser más útil en cuanto al equipo funcione un poco mejor mira que estoy hablando del polista que tela pero me da razones para pensar un poco mejor que a partir de ahora a Vitor Pereira lo de la defensa vea bueno y creichi y a partir de ahí hacemos el resto del once porque creo que durante este inicio de temporada no ha sabido muy bien que era lo que le funcionaba ahí sabe que esos dos le están funcionando",810,161
QXxxl8ckqDY,4852.14,4862.14,10.0,SPEAKER_00,"y a Vitor Pereira le concedo la cintura de haber dicho vale no me está funcionando la línea de tres este año no estoy siendo igual de sólido, voy a cambiar a esto se lo concedo a Vitor Pereira",192,39
QXxxl8ckqDY,4862.14,4876.14,14.0,SPEAKER_01,¿Cuál fue el partido que todo lo malo pasaba por el lado contrario a Toti Gómez? y en cada jugada había a Toti Gómez mirando a Gvalu pero estáis borrachos ¿Qué hacéis?,167,32
QXxxl8ckqDY,4876.14,4878.14,2.0,SPEAKER_00,contra el Leeds,15,3
QXxxl8ckqDY,4878.14,4902.14,24.0,SPEAKER_01,"bueno amigos pues hasta aquí el largo repaso de los 20 clubes con lo que nos ha gustado y lo que no ahora os esperamos en comentarios para que nos comentes de tu equipo, qué es lo que más te ha gustado y lo que menos te ha gustado con qué cosas estás de acuerdo y con qué cosas no, son 20 equipos, son videos largos en los que hay que repasar todo lo que está sucediendo en la Premier porque ya que estamos en parada de selecciones pues lo queríamos hacer ahora para retomar la dinámica de la Premier",500,100
QXxxl8ckqDY,4902.14,4910.14,8.0,SPEAKER_00,"hora y veinte de videos, si no das like si no das like hoy me decepciones tengo un hombre niño pero venga, nos vamos a comer",124,26
QXxxl8ckqDY,4910.14,4912.14,2.0,SPEAKER_??,o a mi me decepciones,21,5
