audio_id,start_sec,end_sec,duration_sec,speaker,text,n_chars,n_words
QXxxl8ckqDY,2367.34,2406.14,38.79999999999973,SPEAKER_01,"Claro, esa es otra. Pero ya os digo, a lo mejor, por decir algo negativo, el encaje de todo el talento defensivo. Vamos con el décimo clasificado, el Manchester United. Y aquí, en cuanto a lo bueno, a mí lo que me ha gustado y va un poco en contra de las estadísticas, es Mateus Kuña. Yo sigo insistiendo que a mí Kuña me está pareciendo desde el principio fundamental para dar la fluidez al equipo, que el sistema no le está dando. Pero siempre que veo a Kuña, sé que ha tenido partidos mejores, partidos peores. Pero de verdad que su encaje, me está gustando, cero goles, cero asistencias, como dos soles. Pero ya lo considero fundamental. Y ha habido muchos partidos que me han gustado.",689,127
QXxxl8ckqDY,2406.14,2408.14,2.0,SPEAKER_00,Ve tú porque es parecido.,25,5
QXxxl8ckqDY,2408.14,2414.14,6.0,SPEAKER_01,"Entre líneas de verdad, si no es para romper líneas, si no está Mateus Kuña, al equipo le cuesta una barbaridad. A mí me ha parecido Kuña el mejor del ataque del United.",169,33
QXxxl8ckqDY,2416.14,2438.14,22.0,SPEAKER_00,"Yo no soy el mejor, pero vamos. Claro, es que yo creo que para mí el mejor ha sido Brian Embeumo porque creo que ha sido el más consistente, por así decirlo, el más constante, mejor dicho. El liderazgo que está teniendo es lo que más me está gustando de Embeumo. Creo que está siendo un poco el que ha tirado del carro en muchos partidos en ese ataque y que sobre todo creo que es el que mejor se está entendiendo con Benjamin Isesco.",434,85
QXxxl8ckqDY,2438.14,2456.14,18.0,SPEAKER_01,"Está faltando ese puntito de... Puntería. Y a veces incluso de, no sé, esos intangibles de, estoy pasando por una fase de la temporada inspirado, llego una décima de segundo antes a un balón, conecto antes la parada que me hace Donnarumma, pues no, le sale Donnarumma, pero a mí me está gustando. Es que el año pasado",317,58
QXxxl8ckqDY,2456.14,2482.14,26.0,SPEAKER_00,"me dio todo, es la realidad. Y me quedo con algo que está sucediendo en defensa y es que Matis de Leeds sigue demostrando que él podría ser titular en un Manchester United funcional y que luchase por los títulos. Me parece que es una víctima no del sistema, porque le sienta bien la línea de tres, pero que es una víctima de un pésimo Manchester United y que creo que es un central que muchos equipos que están puntuando mejor que el United ni se acercan a tener.",463,89
QXxxl8ckqDY,2482.14,2516.14,34.0,SPEAKER_01,"Así que me quedo con Matis de Leeds. Yo en cuanto a lo malo, he estado dando varias cosas y me acabo quedando con la ayuda a Benjamin Sesco. Creo que en muchos partidos se señala Benjamin Sesco y es un jugador que apenas se le ha permitido brillar, que no ha tenido un demasiado buen servicio por parte de sus compañeros para prolongar jugadas, para estar en zonas de remate y aparecer en esas zonas. Y en definitiva ser el 9 que quiere el Manchester United. Hay partidos en los que ha aparecido muy poquito y lo que ha hecho me ha gustado, pero creo que necesita más de su equipo. Mi crítica no es tan individual hacia Sesco.",626,120
QXxxl8ckqDY,2516.14,2552.14,36.0,SPEAKER_00,"Yo sí voy a individualizar una crítica que es hacia Rubén Amorín, que es lo que no me está gustando para nada. Creo que el otro día tuvo su primera victoria cómoda casi desde que llegó. No veo el encaje de su idea ahora mismo con la plantilla que tiene el Manchester United. Se empecina en ello y luego sobre todo a mí me mato cuando termino desdibujado todo el equipo por mantener su estructura y su idea contra el Brentford. Yo es parecida, pero voy a ser más directo y es que el equipo juega horrorosamente mal al fútbol, quitando el partido contra el Arsenal.",563,106
QXxxl8ckqDY,2552.14,2554.14,2.0,SPEAKER_01,Convalida como Rubén Amorín.,28,4
QXxxl8ckqDY,2554.14,2574.14,20.0,SPEAKER_00,"Pero ahora voy con uno. Quitando el partido contra el Arsenal y quitando el primer partido y el último contra el Sunderland. No me gusta nada cómo juega y cada vez que veo a Bruno Fernández en la base de la jugada me quiero quitar los ojos. ¿Porque Bruno Fernández lo hace mal? No. ¿Por qué no entiendo? ¿Por qué el United no fichó a un centro de la pista creativo y permitió así, o sea, permitiendo así que Bruno Fernández jugase",430,82
QXxxl8ckqDY,2574.14,2612.14,38.0,SPEAKER_01,"de media punta? Vamos con el Newcastle United con el undécimo clasificado. A mí del Newcastle y viendo las cosas que me habíais dejado porque bueno, iba a coger las dos probablemente. Sí me quiero quedar con que juegue Nick Pope. Me encanta que esté jugando a Nick Pope, que no esté jugando Aaron Ramsdale. No las tenías todas contigo a principio de temporada. Vamos, un tío que no ha dado ninguna razón para sentarlo, que me sigue transmitiendo una seguridad enorme. ¿Es el portero perfecto? ¿Es de los mejores porteros del mundo? No, pero para lo que necesita el Newcastle me sigue pareciendo un portero fantástico, de garantías y de los de toda la vida además. Así que estoy contento con su rendimiento. Por cierto, lidera la carrera por el Guante Oro con cinco porterías a cero y mucho tiene que ver",803,143
QXxxl8ckqDY,2612.14,2642.14,30.0,SPEAKER_00,"su rendimiento. Me quedo con Sandro Tonali, otra temporada en la que demuestra que es uno de los mejores centrocantistas de la Premier League y que empieza a ser Bruno Guimara, si es el gran líder del equipo, pero que empieza a ser también uno de los grandes líderes de este Newcastle. El líder silencioso. Sí, un poco silencioso. Salida de balón, equilibrio defensivo, buen balón parado porque tiene un gran pie. Me parece que es uno de estos infravalorados porque se habla menos de él que de otros centrocantistas y es uno de los mejores centrocantistas de la Premier League.",577,101
QXxxl8ckqDY,2642.14,2652.14,10.0,SPEAKER_01,"Además, creo que es un jugador que no hay demasiados en el mundo como él. Con ese despliegue y al mismo tiempo esa capacidad técnica para hacer jugar al equipo. Es una bendición tenerlo",185,34
QXxxl8ckqDY,2652.14,2666.14,14.0,SPEAKER_00,"en Newcastle. Y cada vez sonría tan poco. No sonría nada. No está muy contento. No está contento. No le culpo por no estar contento allí. Por la ciudad. Vaya hombre. No, no por el equipo.",187,36
QXxxl8ckqDY,2666.14,2670.14,4.0,SPEAKER_01,Por los aficionados. Si digo la ciudad no pasa nada.,52,10
QXxxl8ckqDY,2670.14,2722.14,52.0,SPEAKER_00,"Y sobre todo por Sunfender. En esta vez no he querido huir de lo más importante que me está pareciendo esta temporada que es Voltemade. Creo que han acertado a Ediño en el regal de Isaac. Creo que se han acertado. Ediño siendo un jugador totalmente distinto al sueco. Creo que ha encajado como un guante. Creo que le está aportando muchísimas cosas al Newcastle. Y creo de hecho que no está siendo bien acompañado. Y ya de hecho hilo con lo que no me ha gustado que es el ANGA. El que llegaba para ser el antes de Voltemade, el fichaje estrella de este año del Newcastle a revitalizar ese ataque. Creo que lo está haciendo absolutamente todo mal. Ya no solo en cuanto a toma de decisiones sino ya luego también en cuanto a finura en el toque. Creo que es todo mal lo del ANGA en este inicio.",791,151
QXxxl8ckqDY,2722.14,2732.14,10.0,SPEAKER_01,"En cuanto a lo que no me gusta es sorprendente porque es un equipo que depende de un futbolista que no ha jugado ni un minuto, que es Joan Bisa. Pero la dependencia en Bisa ya es evidente sin haberlo visto en el campo.",218,44
QXxxl8ckqDY,2732.14,2736.14,4.0,SPEAKER_00,Vaya bala habéis esquivado con el cruzado.,42,7
QXxxl8ckqDY,2736.14,2766.14,30.0,SPEAKER_01,"Voltemade necesita jugadores a su alrededor que tengan talento para finalizar. Y ahora mismo Gordon no lo aporta, Barrensson no lo aporta, Molfi no lo aporta porque Molfi es asistente más que finalizador y el ANGA, pues hombre, espero que le sirva ese partido contra la Unión Sangiloá para construir ahora una racha positiva. Pero está echándolo mucho en falta de Voltemade y está además asumiendo él una carga goleadora que le corresponde pero que no quiero que sea demasiado alta porque es un equipo con graves problemas. No lo odiemos, ¿no? Es un equipo con graves problemas de finalización.",594,100
QXxxl8ckqDY,2766.14,2822.14,56.0,SPEAKER_00,"Y lo que menos me ha gustado a mí es Anthony Gordon. Ha pasado de ser por momentos la gran estrella del Newcastle arriba, incluso en ciertos tramos de hace dos temporadas por encima de Alexander Isak, a que esté en un enorme valle de rendimiento. Lleva cero goles y cero asistencias en cuatro partidos porque estuvo tres fuera por una expulsión, que eso también se lo achaco porque es su culpa y ahora parece que directamente el Newcastle como tú dices es mejor. Cuando Gordon está en el banquillo que cuando Gordon está en el campo. Y eso me parece algo que hace dos años era inimaginable porque el inglés era una de las grandes estrellas. Chozas, ¿qué te ha gustado del Brighton decimos segundo clasificado? Me quiero quedar con Diego Gómez. Ya me gustó mucho la segunda mitad de temporada pasada. Eso es, me gustó mucho en esa segunda mitad de temporada y creo que ha empezado muy bien la temporada tanto cuando está jugando un poco más atrás en la base como cuando Jusceler le pide esa cuota de llegada un poco más adelante en el campo. Entonces me está gustando.",1067,194
QXxxl8ckqDY,2822.14,2836.14,14.0,SPEAKER_01,"Tenemos foto del Brighton en joval bien. Es verdad, es verdad. Vaya pillada que le he hecho. Vaya pillada que le he hecho. Que no le cae bien más mi perre. Ay mira mi colega. Bueno, ¿qué es lo que te ha gustado Pablo?",217,44
QXxxl8ckqDY,2836.14,2850.14,14.0,SPEAKER_00,"A mí que siguen siendo competitivos contra los grandes. Ganaron 2-1 al City, 2-2 contra el Tottenham y ganaron 1-3 al Chelsea. Hay que reconocerse a Jusceler contra los equipos grandes. El Brighton compite muy bien. A mí me ha gustado",234,41
QXxxl8ckqDY,2850.14,2866.14,16.0,SPEAKER_01,"a Jancub Aminte. Es un jugador que no me gusta. No es que no me guste, pero lo veo muy verde. Te duquea. Pero quiero agarrarle la mano. Bueno, hay muchas cosas. A mi hermano Alex De Llanos y meto aquí a Jancub Aminte.",217,44
QXxxl8ckqDY,2866.14,2868.14,2.0,SPEAKER_00,A pensar que ibas a decir a Mint.,33,8
QXxxl8ckqDY,2868.14,2908.14,40.0,SPEAKER_01,"Ellos todos ya le agarran lo que quieran a Mint. De Llanos y yo nos agarramos lo que queremos. Pero me está gustando. Me parece lo más desequilibrante de un equipo que no muchas veces es un equipo de fantasía. Lleva además un gol y dos asistencias. Pero dentro de lo que a veces me desespera Mint, me está pareciendo un buen inicio. Vamos ahora con lo malo. Vuelvo a hablar de individualidades. Carlos Vallevá sin ninguna duda. No me está gustando su inicio de temporada. No le han sentado bien los rumores del verano. Y sobre todo está, creo, acentuando aún más las cosas en las que ya creía que era débil Vallevá. Pero su inicio no me está gustando.",651,121
QXxxl8ckqDY,2908.14,2958.14,50.0,SPEAKER_00,Para mí la falta de un goleador. Solo Vuelve que ha marcado más de un gol. Stefano Tsimas que se le fichó por creo que son 30 y pico millones. Ha jugado solo 51 minutos. Y Jalalan Poscostoulas que también llegó a los 35 millones ni ha llegado a debutar. No es una crítica a los dos griegos porque son los dos muy jóvenes. Es una crítica a la gestión del Brighton en el mercado. Has llegado y te has plantado toda esta temporada y has jugado solo con Dani Vuelve como delantero. Y creo que les va a pasar factura. Yo me quedo con la inexistente valentía de Hurszöller en la mayoría de partidos. Creo que es un entrenador a Marrategui que en muchos partidos se está quedando cortísimo y que de hecho creo que esa no me sale decirlo. Pero esa era Marrategui y le ha costado puntos al Brighton.,790,152
QXxxl8ckqDY,2958.14,2972.14,14.0,SPEAKER_01,"Para mí es conformismo. Sí, yo tenía la palabra pero no sé si vamos a reír. Es un poco más exagerada. Vamos con el Aston Villa. El décimo tercer clasificado. Ahí tenéis a nuestro amigo Harvey y Eliot en pantalla. ¿Qué es lo que más os ha gustado?",246,48
QXxxl8ckqDY,2972.14,3004.14,32.0,SPEAKER_00,"Para mí la recuperación del Divu. Creo que estamos hablando muy poco del show que fue el verano del Divu y completamente el último día del Divu Martínez. No por su culpa en el Aston Villa. Estamos hablando de un futbolista que el 1 de septiembre en Deslinday estaba en la ciudad deportiva del Villa esperando a que le dieran el OCC para recoger las cosas y irse al Manchester United. El clic que ha hecho el Divu, el portero argentino tan rápido, tanto él como Emery para decir te ibas a ir pero como te quedas vas a volver a ser titular, creo que es algo muy positivo tanto por su parte como por parte de la Aston Villa.",621,120
QXxxl8ckqDY,3004.14,3008.14,4.0,SPEAKER_01,"¿Qué es lo que más te ha gustado de la Aston Villa? No es un buen inicio, todo se ha dicho.",91,21
QXxxl8ckqDY,3008.14,3028.14,20.0,SPEAKER_00,Bogard. Creo que con la lesión de Tilemans el equipo necesitaba alguien ahí que por lo menos salvara la situación hasta que vuelva él y creo que ha dado un paso adelante y que está formando una buena pareja con Cámara que sigue siendo de lo más importante que tiene el Villa para esa posición. Pero me está gustando esa búsqueda.,329,61
QXxxl8ckqDY,3028.14,3064.14,36.0,SPEAKER_01,"Yo me quedo con Bubacar Cámara porque quizá me parece el mejor futbolista del Villa esta temporada. Constante por excelencia, cada vez que las lesiones le respetan es un futbolista que te demuestra que es un seguro para la Aston Villa. Por supuesto sin el balón pero también con la pelota. Es otro jugador, no se parecen demasiadas cosas a Tonali pero que también me parece muy difícil de encontrar en el mercado y con el Villa. Con tantos problemas. En cuanto a reencontrar la mejor versión de muchos de sus futbolistas importantes y ahora hablaremos también de Tilemans Cámara me parece capital y esta temporada me sigue gustando mucho. ¿Qué es lo que no os ha gustado?",671,118
QXxxl8ckqDY,3064.14,3120.14,56.0,SPEAKER_00,"Para mí el mal momento de Oli Watkins. Solo un gol en siete partidos, ha fallado ocasiones que no acostumbraban los dos últimos años y en general para mí se ha caído como estrella de la Premier League. Para mí creo que Oli Watkins es un futbolista lo definió no sé quién fue no sé si fue el propio McGinn, que es un futbolista muy de rachas, con rachas muy marcadas y cuando está enchufado es un delantero del copón pero no es un futbolista para echarse al equipo a la espalda y cuando Peor pintaba las cosas para el Villa ha tenido que salir McGinn, por ejemplo, para salvarlo. No ha sido Oli Watkins y eso no me ha gustado. A mí otro que no me ha gustado en el momento más complicado de la Aston Villa como no ha liderado es Morgan Rogers. Creo que tenía que haber sido el líder de ese ataque en este inicio de temporada y no ha aparecido para nada. No estoy viendo nada de la autosuficiencia que le presupongo a él. No ha sido capaz de girar a los equipos rivales con esas conducciones haciéndose fuerte. No está ofreciendo gran cosa.",1037,199
QXxxl8ckqDY,3120.14,3160.14,40.0,SPEAKER_01,"A mí me parece un bajón bastante considerable el de Rogers, más aún incluso que el de Watkins. Yo me quedo en cuanto a aspecto negativo con que es un equipo que depende demasiado de Juri Thielemans. Cuando no está Thielemans se nota una barbaridad y cuando está se le necesita a veces como enganche y entonces es un jugador que juega por delante del doble pivote y ahí entonces no está en la base de la jugada. Son demasiadas cosas que le pide hacer el Aston Villa para Thielemans y cuando no las puede hacer el equipo no carbura. Esa dependencia me parece peligrosa de cara al resto de la temporada por muy bueno que me parezca a cámara. Vamos al Fulham. ¿Qué es lo que más os ha gustado del Fulham? Del último cuarto clasificado. Yo me voy a quedar",750,142
QXxxl8ckqDY,3160.14,3188.14,28.0,SPEAKER_00,con Ryan Señor. Otro que también su segunda mitad de temporada me pareció muy buena y que creo que se ha confirmado como un titular indiscutible para Marco Silva ya tanto en ataque como en defensa. O sea ha sentado a Anthony Robinson en el lateral que creo que eso son palabras mayores y le está rindiendo muy bien a Marco Silva tanto en una posición más atrasada como la de lateral llegando mucho ataque y participando mucho como luego cuando ha tenido que jugar arriba.,471,86
QXxxl8ckqDY,3188.14,3224.14,36.0,SPEAKER_01,Yo por recoger y relacionarlo con lo que dices yo lo que he dicho es como la cosa de más me ha gustado es saber vivir sin Robinson. Robinson el año pasado te aporta 10 asistencias y es de lo mejor en su posición en el lateral izquierdo de toda la Premier. Ya sea usando línea de tres centrales o tres centrales sin necesidad de que sean línea de tres. Ya sea usando Ryan Señor pero me parece también que vuelve a demostrarte Marco Silva que no se le cae el equipo pero tiene que hacer algún tipo de movimiento por mucho que en el caso de Anthony Robinson tiene también que ver con su estado físico seguro y que no dudo que dentro de poco lo veremos también ser importante.,672,131
QXxxl8ckqDY,3224.14,3278.14,54.0,SPEAKER_00,"Yo me quedo con Josh Keane. Esperaba muy poquito de él porque sí que es cierto que le metimos en el vídeo de grandes promesas jóvenes a seguir esta temporada pero me esperaba que jugase en todo el año 12, 13 partidos y lleva siete titularidades de siete partidos a ser titular en todos los partidos y es el octavo jugador con dos minutos del full-on. De momento cero goles, cero asistencias porque le tangaron un gol contra el Chelsea pero si no debería llevar un gol. Pero me está dando muy buenas sensaciones. Es rápido, técnico, se mueve bien, me gusta mucho. Lo que no me está gustando y lo oílo así es que estamos dando por perdido a Mille Smith-Rowe. Este 2025 está siendo una confirmación de que ya ni siquiera la afición del full-on dice que tenemos a Smith-Rowe que es uno de los mejores fichajes que hemos hecho nunca. En un año hemos pasado de decir que lo va a petar en los cotailleurs a que ni siquiera juegue. Ha jugado en todos los partidos pero siempre como suplente lleva tan solo 124 minutos al inglés.",1020,190
QXxxl8ckqDY,3278.14,3336.14,58.0,SPEAKER_01,"Yo lo que no me ha gustado del full-on son los momentos en los que el equipo durante los partidos se desmorona y no hay manera de cerrar esa herida. Hay varios partidos en los que me ha dado esa sensación. Contra el Bournemouth, los Cherries les meten tres goles entre el minuto 78 y el final del partido. El Aston Villa les mete otros tres goles entre el minuto 37 y el minuto 51 y me llama mucho la atención ese momento en el que están cerrando tan mal algunas primeras partes para luego abrirlas igual de mal, que no les sirve el descanso porque lo mismo les pasó contra el Chelsea. El Chelsea les marcan el descuento de la primera parte y casi en los primeros diez minutos de la segunda. Creo que ahí es un equipo que todavía tiene que trabajar ese aspecto quizá también psicológico, no solo futbolístico, para sujetarse en los momentos en los que el equipo rival va con todo y por qué no, incluso tienes que llevar unos cuantos bandazos tienes que aguantar el chaparrón pero no hay muchos chaparrones que hayan aguantado en este tipo de situaciones, son tres jornadas",1072,198
QXxxl8ckqDY,3336.14,3352.14,16.0,SPEAKER_00,diferentes de siete. A mí ya en lo que no me ha gustado Harry Wilson por delante de Chukwese y de Kevin. Creo que no está portando ninguna solución al ataque del Fulham y que lo poco que han podido salir tanto Kevin como Chukwese me están gustando mucho más.,258,50
QXxxl8ckqDY,3352.14,3356.14,4.0,SPEAKER_01,"¿Y qué te está gustando de Leeds United, el equipo clasificado?",63,11
QXxxl8ckqDY,3356.14,3386.14,30.0,SPEAKER_00,"Me he querido quedar con Daniel Farke Quiero darle a él ese premio porque creo que es la temporada en la que mejor se está adaptando a la Premier League Se ha dejado, lo hablábamos ayer en el vídeo de Ascendido, se ha dejado de tonterías Está siendo un Leeds mucho más sólido mucho más compacto defensivamente y les falta gol arriba pero creo que están compitiendo muy bien y mucho mejor por supuesto que recién ascendidos de otras temporadas",442,80
QXxxl8ckqDY,3386.14,3388.14,2.0,SPEAKER_01,¿Qué te agrada de los whites?,29,6
QXxxl8ckqDY,3388.14,3426.14,38.0,SPEAKER_00,"A mí la línea defensiva formada por Joe Rodon, Strzok, Bogle y Goodmanson porque no confiaba nada en ella les conocía de sobra a tres de ellos menos a Goodmanson y pensaba que se iban a volver a deshacer como un azucarillo en la Premier League y que Leeds iba a ser una feria defensiva y han encajado solo diez goles a pesar de que han tenido que jugar cuatro partidos con Card Darlow en la portería por todo suplente porque Lucas Perry se ha lesionado hay solo siete equipos que hayan encajado más que me parece importante porque no son números de ascender y eso es el objetivo del Leeds y hay que tener en cuenta que cinco goles se los marcó el Arsenal así que la mitad de los goles los encajaron en un solo partido esa línea defensiva me está gustando mucho",760,145
QXxxl8ckqDY,3426.14,3432.14,6.0,SPEAKER_01,y es el Leeds que nos hayamos acostumbrado a bueno si encajamos 700 goles pero marcamos 900,91,17
QXxxl8ckqDY,3432.14,3436.14,4.0,SPEAKER_00,Mirá como se ha calvado Néstor ¿Puede defender?,47,8
QXxxl8ckqDY,3436.14,3478.14,42.0,SPEAKER_01,"Bueno en el caso de lo que más me ha gustado es el perfil tan físico del equipo que creo que está muy bien entendido respecto a lo que ahora mismo pide la Premier League pero si quiero enfocarlo en una sola persona es Sean Longstaff creo que incluso tiene argumentos para decir que está siendo el mejor del Leeds United y por supuesto de los mejores ganador de duelos, suficiente con el balón ha marcado ya incluso un golazo impresionante en esta Premier League con los whites, parece que lleva toda la vida jugando en el Leeds y es exactamente el perfil que confirma un poco que me gustó me gustó su fichaje para el nivel del Leeds y para lo que necesitaba y todos los augurios más optimistas la verdad es que se están cumpliendo con Sean Longstaff en cuanto a lo malo",769,145
QXxxl8ckqDY,3478.14,3522.14,44.0,SPEAKER_00,Te diría que casi lo único que no me está gustando del Leeds es el extremo derecho creo que ahí tienen un déficit muy importante porque Okaforin así que me está gustando pero ni James ni Brendan Aronson me están gustando nada y creo que no es el extremo derecho que necesita un candidato a salvarse en el once titular no le aporta ni gol ni generación yo voy directamente a que el Leeds no tiene gol Okaforin no ha marcado dos goles pero ni en Mecha ni Calverluin tiene pinta de que vayan a funcionar como grandes goleadores Okaforin es el único que lleva más de un gol en este Leeds sobre todo la sensación de que gustándome como está jugando Calverluin veo lo que sigue fallando y digo es que va a volver a quedarse con 7 o 8 goles,733,142
QXxxl8ckqDY,3522.14,3582.14,60.0,SPEAKER_01,"yo reconozco que soy un poco injusto con él porque no me parece una mala temporada pero últimamente si ha tenido algún error o ha salido en alguna foto Pascal Strauch que quiere decir esto que dentro de que no tenía muchas cosas negativas en las que elegir y que Joe Rodan me parece que tiene que ser el comandante de esa defensa creo que hay un margen de mejora si pruebas a Bejol en vez de a Strauch y creo que ahí puedes ganar un buen rematador por arriba un tipo además que siga con esa dinámica o con esa tendencia, es un equipo muy físico que proteja bien su área reconozco que Caldarlow no me parece ninguna maravilla en Premier pero no lo ha hecho horrorosamente mal pero me parece que no es suficiente aunque confío en que Perry si lo va a ser pero sí que en ese caso señalaría Strauch como una pieza que puede mejorar si cambias a Bejol vamos ahora con el 16o Benford está fuera del descenso el equipo de Keith Andrius, ¿qué es lo que más os ha gustado?",963,187
QXxxl8ckqDY,3582.14,3616.14,34.0,SPEAKER_00,"Para mí el paso hacia adelante de Jägor Jarmolyuk si Chozas era muy oscarbovista yo soy muy Jarmolyukista me parece un futbolista que tiene todo lo que necesita el Benford en un centro campista claro comprimido en un futbolista que gana duelos, que tiene buen toque de balón que evidentemente no tiene una gran salida pero el Benford no la necesita, que lucha que además puede tener llegada que está creciendo de cada año, es mejor así que me gusta mucho Jägor Jarmolyuk de 15 titularidades, la temporada pasada lleva 7 de 7 esta",529,94
QXxxl8ckqDY,3616.14,3622.14,6.0,SPEAKER_01,"y eso me hace feliz me hace feliz, a mi no me parece tan espectacular Jarmolyuk igual es una cosa",97,20
QXxxl8ckqDY,3622.14,3630.14,8.0,SPEAKER_00,solo para mí es un buen futbolista le veo con un recorrido en la Premier League bastante importante,99,18
QXxxl8ckqDY,3630.14,3640.14,10.0,SPEAKER_01,creo que este es su nivel pero no sé si y es buena noticia para el Benford pero bueno me lo tengo que creer un poco más a Jarmolyuk,131,29
