start_sec;end_sec;speaker;text
0.000;4.040;SPEAKER_00;Hoy, Pizarritas, hemos preparado un Q&A de lo más completo,
4.120;7.080;SPEAKER_00;ya que en estas últimas semanas estamos hablando mucho de Madrid,
7.160;8.400;SPEAKER_00;Barça y Atlético de Madrid,
8.480;11.760;SPEAKER_00;pues hoy nos vamos a centrar en los otros 17.
20.200;22.240;SPEAKER_00;¿Qué pasa, Pizarritas?
22.320;26.080;SPEAKER_00;Ya estamos aquí con un nuevo Q&A centrado en la Liga española
26.160;28.840;SPEAKER_00;a partir, básicamente, de la cuarta posición,
28.880;32.360;SPEAKER_00;porque, insisto, ya estábamos hablando mucho de Barça y Real Madrid,
32.440;35.080;SPEAKER_00;sobre todo de ellos dos, también habíamos hablado del tema Griezmann,
35.160;37.680;SPEAKER_00;habíamos hablado mucho de la Atleti en anteriores Q&A,
37.760;40.120;SPEAKER_00;y digo, bueno, vamos a centrarnos en el resto también,
40.200;42.840;SPEAKER_00;que son muy importantes aquí en nuestro canal.
42.920;45.600;SPEAKER_00;¿Qué tal, Adrián Blanco, Álex de Jan, Unauel Miranda, cómo estáis?
45.680;47.280;SPEAKER_00;¿Qué tal, chicos? Muy buenas.
47.360;48.440;SPEAKER_00;¿Cómo estamos?
48.520;49.800;SPEAKER_00;¿Qué tal? Muy buenas.
49.880;53.360;SPEAKER_00;¿Os parece bien la idea de preguntarles, primero,
53.440;54.840;SPEAKER_00;a los Pizarritas por otros temas
54.920;56.840;SPEAKER_00;y que sean ellos los que nos lancen los debates?
56.960;60.240;SPEAKER_00;Pues hoy vamos a hablar de Real Sociedad, de Sevilla, de Villarreal,
60.320;63.120;SPEAKER_00;del descenso, de cuestiones generales también bonitas.
63.200;64.280;SPEAKER_00;¿Os parece correcto?
64.360;65.880;SPEAKER_01;Siempre hablamos de todo, Miguel.
65.960;68.680;SPEAKER_01;Lo paso siempre... Hay alguno que llora, pero siempre hablamos de todo.
68.760;71.720;SPEAKER_00;No, no, no, pero fíjate, no ha sido nada...
71.800;73.880;SPEAKER_00;No he escuchado comentarios al respecto,
73.960;76.880;SPEAKER_00;pero sí que es verdad que me gusta, al final de cada semana,
76.960;79.440;SPEAKER_00;echar una vista atrás a lo que hemos hecho en el canal
79.520;81.520;SPEAKER_00;y, claro, al final, la Copa del Rey,
81.600;84.600;SPEAKER_00;la Champions con el Barça, la renovación de Griezmann.
84.680;88.960;SPEAKER_00;Ostras, estábamos haciendo demasiado de esos tres
89.040;92.080;SPEAKER_00;y me parece una bonita forma de compensarlo
92.160;95.080;SPEAKER_00;y sé que nuestros Pizarritas, que son la gran mayoría de Barça,
95.160;97.600;SPEAKER_00;María Atleti, también creen en nuestro contenido
97.680;98.920;SPEAKER_00;y en el contenido de la Liga española,
99.000;100.720;SPEAKER_00;así que sé que también van a dar like,
100.800;102.920;SPEAKER_00;porque, por ejemplo, la primera cuestión...
103.000;106.280;SPEAKER_00;Creo que es una cuestión interesante, de verdad, sí, al turrón.
106.360;110.040;SPEAKER_00;Adrian Blanco pregunta Gaucha Pastor.
110.120;113.720;SPEAKER_00;Teniendo en cuenta la política de fichajes del IMP,
113.760;117.800;SPEAKER_00;que sería algo bastante complejo de explicar, analizar...
117.880;121.920;SPEAKER_00;De hecho, me parece bastante atrevido llamarle política, ¿vale?
122.000;124.120;SPEAKER_00;Aunque solo sea por rentabilidad a futuro,
124.200;127.200;SPEAKER_00;no veis completamente obligatorio traer en propiedad
127.280;128.920;SPEAKER_00;a Enzo Barrenechea.
129.000;131.080;SPEAKER_00;Hay que recordar, Adri, que no hay opción de compra,
131.160;133.120;SPEAKER_00;como sí en el caso de Omar Sadik.
133.200;135.520;SPEAKER_03;Sí, hay que negociar por Barrenechea.
135.600;139.400;SPEAKER_03;A ver, sí, sería una grandísima opción para el Valencia,
139.480;142.080;SPEAKER_03;porque creo que está rindiendo muy bien
142.120;145.160;SPEAKER_03;y me parece un futbolista de nivel...
145.240;147.920;SPEAKER_03;Top, de nivel muy importante para el equipo.
148.000;150.920;SPEAKER_03;Pero, como es todo lo que es en Ameriton,
151.000;153.200;SPEAKER_03;como ya sabemos qué pasa con Peter Lin,
153.280;154.880;SPEAKER_03;ya veremos qué pasa en verano, pero sí,
154.960;157.360;SPEAKER_03;probablemente sería un gran acierto por parte de Valencia
157.440;159.720;SPEAKER_03;para quedarse al jugador, para sacar una plusvalía.
159.800;162.480;SPEAKER_00;¿De cuántos millones estamos hablando, Álex?
162.560;163.760;SPEAKER_00;Más o menos.
163.840;165.640;SPEAKER_02;Pues yo creo que...
165.720;167.560;SPEAKER_02;Yo creo que veniendo de Aston Villa y demás,
167.640;171.440;SPEAKER_02;yo creo que no va a bajar de los 30 o 35.
171.480;172.440;SPEAKER_00;Es que ahí no...
172.520;173.680;SPEAKER_02;Me parece inviable.
173.760;177.000;SPEAKER_02;O sea, yo primero creo que me parece inviable por el Aston Villa,
177.080;181.880;SPEAKER_02;o sea, porque además lo obtienen en una operación muy bien trabajada
181.960;185.080;SPEAKER_02;al dejar ir a Douglas Lewis a la Juve.
185.160;187.720;SPEAKER_02;Y yo creo que ahí negocia muy bien el Aston Villa
187.800;190.040;SPEAKER_02;y se hace con un futbolista, obviamente, del futuro.
190.120;192.880;SPEAKER_02;Pero sí que vería viable una cesión de un año más.
192.960;195.080;SPEAKER_02;O sea, ahí no sé si el Aston Villa va a primar...
195.160;197.400;SPEAKER_02;Oye, prefiero que se vaya a fútbol inglés,
197.480;200.160;SPEAKER_02;que empiece a coger ritmo a Premier, etcétera, y tal,
200.200;204.000;SPEAKER_02;o que continúe con un entrenador que le está haciendo crecer como Corberán.
205.680;207.760;SPEAKER_01;Nada, a mí me parece muy improbable.
207.840;210.120;SPEAKER_01;Creo que es un jugador que ha demostrado estar por encima
210.200;213.000;SPEAKER_01;de la realidad del Valencia ahora mismo, en el pretexto deportivo.
213.080;215.480;SPEAKER_01;Así que entre que la política no existe
215.560;217.760;SPEAKER_01;en materia deportiva del Valencia,
218.560;220.680;SPEAKER_01;va a ser un verano muy raro el Valencia.
220.760;224.760;SPEAKER_01;Nadie ha entendido todavía de dónde sale la idea de traer a Corberán,
224.840;226.280;SPEAKER_01;de dónde aparece el dinero.
227.160;229.560;SPEAKER_01;Yo con los cambios en la directiva estaba convencido
229.560;232.680;SPEAKER_01;de que Corona tenía los días contados y todavía sigue en el club.
232.760;235.800;SPEAKER_01;Entonces, es un verano muy raro,
235.880;239.920;SPEAKER_01;pero como en veranos normales de lo que ha venido siendo el Valencia
240.000;242.920;SPEAKER_01;en los últimos años, lo vería imposible.
243.000;247.280;SPEAKER_00;Otra cosa es que cambie la realidad, que cambie el contexto del Valencia,
247.360;248.640;SPEAKER_00;y podemos estar hablando de otras cosas.
248.720;250.600;SPEAKER_00;Evidentemente, entre Aston Villa y Valencia
250.680;252.600;SPEAKER_00;hay una conexión bastante potente.
252.680;254.960;SPEAKER_00;Básicamente, por ejemplo, por el caso de Damien Abidagain,
255.040;256.240;SPEAKER_00;que le conocemos nosotros de sobra,
256.320;259.000;SPEAKER_00;que le hemos tenido también de compañero en Radio Marca.
259.000;260.360;SPEAKER_00;Ahí puede haber una buena relación,
260.440;266.480;SPEAKER_00;pero si Emery lo necesita o si el Aston Villa recibe una gran oferta,
266.560;268.400;SPEAKER_00;creo que excede las posibilidades del Valencia.
268.480;271.240;SPEAKER_00;Lo que sí que creo es que es una pena,
271.320;275.160;SPEAKER_00;sobre todo para el Valencia, pero también, evidentemente, para la Liga,
275.240;279.200;SPEAKER_00;que esa política de fichajes que podía ser, no sé si inicial,
279.280;281.800;SPEAKER_00;pero sí en un punto intermedio del proyecto LIM,
281.880;284.520;SPEAKER_00;de buscar jugadores con rentabilidad a futuro,
284.600;288.640;SPEAKER_00;se haya quedado realmente en la nada, porque no es la realidad.
288.760;292.880;SPEAKER_00;Es decir, el Valencia no se ha convertido en un Dormoon Lite
292.960;295.600;SPEAKER_00;o en un LIL, que esto también lo ha hecho, no.
295.680;300.880;SPEAKER_00;El Valencia se ha ido descapitalizando y ha ido fichando...
300.960;302.640;SPEAKER_00;hombre, está muy feo decir...
302.720;306.160;SPEAKER_00;Sí, gracias por el término, porque a mí se me iba a ocurrir uno más feo.
306.240;308.720;SPEAKER_00;Fichando retales con lo que podía,
308.800;311.280;SPEAKER_00;recordamos el caso de Carlos Vicente, que es paradigmático,
311.360;312.880;SPEAKER_00;lo que costó traer...
312.960;314.200;SPEAKER_00;A Canos.
314.280;317.280;SPEAKER_00;A Canos, que luego, bueno, es que luego el nivel de ser de Canos,
317.320;319.760;SPEAKER_00;por muy valencianista que sea, también es el que es...
319.840;323.400;SPEAKER_00;Ostras, es que no hemos visto, insisto, un proyecto ni una política,
323.480;324.960;SPEAKER_00;es básicamente un...
325.040;327.240;SPEAKER_00;Salve si hay quien pueda, vamos a tratar de mantener el club
327.320;330.920;SPEAKER_00;en primera edición, con lo mínimo posible, y a partir de ahí, tirar.
331.000;334.160;SPEAKER_00;Entonces, claro, un jugador como Barrem Echea y otro como Marsadik,
334.240;337.800;SPEAKER_00;o cambia la realidad del Valencia o parece complicada.
337.880;341.320;SPEAKER_00;Óscar Álvarez pregunta por cómo valoramos la apuesta de la Real
341.400;345.600;SPEAKER_00;por Sergio Francisco, y nos repregunta si hubiéramos preferido
345.640;348.480;SPEAKER_00;que fueran a por Michel, cómo se llegó a rumorear.
351.440;355.080;SPEAKER_02;A ver, a mí me parece que tiene sentido el tema de Sergio Francisco
355.160;357.080;SPEAKER_02;y que creo que es una apuesta coherente
357.160;359.000;SPEAKER_02;dentro de lo que es la Real Sociedad como club
359.080;363.840;SPEAKER_02;y de lo que están queriendo transmitir también dentro de este proyecto.
363.920;366.080;SPEAKER_02;Se va a Olave, Bretos.
366.160;369.320;SPEAKER_02;Se va a Immanuel, Sergio Francisco.
369.400;373.160;SPEAKER_02;Se va a Zubimendi, X medio centro de Zubieta.
373.240;377.240;SPEAKER_02;Yo le veo sentido a lo que está ocurriendo en la Real Sociedad.
377.320;380.400;SPEAKER_02;A mí me parecía que lo de Michel podía ser interesante,
380.480;384.200;SPEAKER_02;pero sí que es verdad que la Real Sociedad y la prensa de Donosti,
384.280;388.320;SPEAKER_02;lo que están exponiendo todos los datos, que la Real Sociedad no tenía tiempo.
388.400;390.720;SPEAKER_02;O sea, no podía esperar a una decisión de un entrenador
390.800;396.400;SPEAKER_02;o no podía dejar que el proyecto no cogiera ese ritmo desde ya.
396.480;398.600;SPEAKER_02;De hecho, Sergio Francisco, si no me equivoco,
398.680;400.880;SPEAKER_02;creo que no va a dirigir hasta el final de temporada.
400.920;403.800;SPEAKER_00;Ya está trabajando en planificación de plantilla
403.880;407.680;SPEAKER_00;y el otro día a Álex con John Cuesva, Joaquín Aperriba.
407.760;411.760;SPEAKER_00;Luego estas cosas, yo me creo la mitad de la mitad,
411.840;415.560;SPEAKER_00;porque luego lo que nos explican siempre son relatos muy convenientes.
415.640;418.120;SPEAKER_00;Porque claro, cada uno está dando su versión y quiere quedar bien,
418.200;419.160;SPEAKER_00;no va a quedar mal.
419.240;421.320;SPEAKER_00;Pero Joaquín Aperriba y el presidente de la Real Sociedad
421.400;424.560;SPEAKER_00;dijo que una vez Immanuel le pide tiempo,
424.640;426.160;SPEAKER_00;Aperriba le tranquilizó diciendo,
426.200;430.240;SPEAKER_00;oye, Ima, tranquilo, porque si tú te vas,
430.320;432.240;SPEAKER_00;es que tenemos a Sergio Francisco.
432.320;435.840;SPEAKER_00;Bueno, yo no sé si ha sido así, no tengo información al respecto.
435.920;441.920;SPEAKER_00;Me parece una visión bastante cómoda,
442.000;445.320;SPEAKER_00;pero es evidente que sí que hay una línea ahí.
445.400;448.920;SPEAKER_02;O sea, tú crees que si, por ejemplo,
449.000;451.480;SPEAKER_02;el Girona ya no tiene objetivo esta temporada,
451.560;453.720;SPEAKER_02;o sea, está salvado y no puede llegar a Europa,
453.760;456.480;SPEAKER_02;¿tú crees que no hubiera sido Sergio Francisco?
456.560;458.080;SPEAKER_00;No lo sé, no lo sé.
458.160;460.960;SPEAKER_00;Lo que creo es que estas cuestiones,
461.040;462.840;SPEAKER_00;aunque siempre se están preparando,
462.920;467.120;SPEAKER_00;o sea, quiero decir, siempre cuando sabes que ZubyMendi empieza a destacar,
467.200;469.720;SPEAKER_00;la Real Sociedad debe llevar mirando a medios centros, ¿qué?
469.800;470.800;SPEAKER_00;¿Tres años?
470.880;471.880;SPEAKER_00;Por si pasa eso.
471.960;474.600;SPEAKER_00;Entonces, con entrenadores probablemente algo parecido.
474.680;477.120;SPEAKER_00;No dudo que fuese el primer plan,
477.200;479.320;SPEAKER_00;pero también creo que hay cosas que el mercado,
479.400;481.040;SPEAKER_00;¿quién decía esto? Que es un organismo vivo, ¿no?
481.120;482.200;SPEAKER_00;Va cambiando, va mutando,
482.240;485.000;SPEAKER_00;y si no, que se lo digan a Carlo Ancelotti y a Brasil.
485.080;489.320;SPEAKER_00;Y imagínate que aparece la opción de Michel muy clara,
489.400;491.680;SPEAKER_00;que el Girona está salvado y Michel dice,
491.760;494.920;SPEAKER_00;oye, mira, no voy a seguir, como ha pasado en muchos equipos,
495.000;496.840;SPEAKER_00;pues a mí me parecía un nombre planteable,
496.920;499.960;SPEAKER_00;pero bueno, que me parece que es una línea lógica de la Real Sociedad.
500.040;501.240;SPEAKER_00;Sin conocer a Sergio Francisco,
501.320;504.760;SPEAKER_00;es imposible valorar cómo de buen entrenador es, honestamente.
504.840;507.080;SPEAKER_03;Claro, a ver, yo estoy de acuerdo que es una línea lógica
507.160;511.680;SPEAKER_03;por el plan de la Real, por su metodología de trabajo,
511.720;513.520;SPEAKER_03;estoy de acuerdo con vosotros y al mismo tiempo
513.600;516.600;SPEAKER_03;me parece un mensaje importante de puertas hacia dentro
516.680;517.680;SPEAKER_03;y también hacia fuera.
517.760;519.600;SPEAKER_03;Oye, rebajamos un poquito las pretensiones,
519.680;521.080;SPEAKER_03;rebajamos un poquito el objetivo,
521.160;523.200;SPEAKER_03;porque creo que haber traído a Michel o a Lopetegui,
523.280;524.960;SPEAKER_03;que eran los entrenadores que sonaban,
525.040;528.000;SPEAKER_03;creo que hubiese sido darle mucha más presión
528.080;530.040;SPEAKER_03;y decir, oye, vamos a dar un golpe más,
530.120;532.680;SPEAKER_03;vamos a dar un paso adelante más con un entrenador
532.760;534.000;SPEAKER_03;que lo viene haciendo muy bien,
534.080;536.200;SPEAKER_03;o un entrenador ya contrastado, como el caso de Jules.
537.080;539.560;SPEAKER_01;Y bueno, yo coincido con vosotros
539.640;541.360;SPEAKER_01;y habría que empezar a trabajar un mote
541.440;542.480;SPEAKER_01;para Sergio Francisco.
542.560;546.640;SPEAKER_01;Sergio Francisco le falta un poquito de punch y de carisma,
546.720;549.440;SPEAKER_01;así que yo invito al pizarrismo a que...
549.520;551.160;SPEAKER_01;Bueno, igual ya lo tiene y no lo conocemos,
551.240;552.720;SPEAKER_01;en fin, que nos lo cuenten un poquito.
552.800;553.800;SPEAKER_01;Pero no crees...
555.240;558.240;SPEAKER_00;No crees que es importante dejarle trabajar,
558.320;562.200;SPEAKER_00;es decir, a ver cómo es, ¿no?
562.280;565.200;SPEAKER_00;O sea, quiere decir, igual el mote, como quien dice,
565.280;567.120;SPEAKER_00;nos lo aporta a él directamente.
567.560;569.960;SPEAKER_03;Sí, igual sale solo una vez lo escuchemos hablar.
570.320;573.720;SPEAKER_00;Claro, mira, por ejemplo, Iñigo Pérez,
573.800;576.960;SPEAKER_00;un entrenador que, a ver, supercarisma no tiene,
577.040;579.640;SPEAKER_00;no habla demasiado con los medios, no se da mucha importancia...
579.720;582.720;SPEAKER_01;Pero a Iñigo Pérez le pega llamarse Iñigo Pérez.
582.800;584.200;SPEAKER_01;Sí, pero, por ejemplo...
584.280;585.280;SPEAKER_01;Pero él...
585.360;588.280;SPEAKER_01;Y ese estar en segundo plano, ese...
588.360;591.720;SPEAKER_00;Pero al mismo tiempo hemos visto una narrativa
591.800;594.360;SPEAKER_00;con Iñigo Pérez y la climatología
594.440;596.400;SPEAKER_00;que le podemos llamar el Rebequitas,
596.480;599.160;SPEAKER_00;porque nunca se la pone, siempre va en manga corta.
599.280;601.000;SPEAKER_00;Entonces, no sé, quiero decir,
601.080;603.280;SPEAKER_00;hay que dejar a Sergio Francisco trabajar
603.360;607.840;SPEAKER_00;en todos los sentidos posibles para ver cómo le va.
607.920;611.320;SPEAKER_01;Que si le llamáramos directamente por el...
611.400;614.080;SPEAKER_01;Me parece que es el segundo apellido, a Sergio Ramos.
614.160;615.280;SPEAKER_01;Uf. Hola.
615.360;616.600;SPEAKER_01;Sergio Francisco Ramos.
616.680;619.240;SPEAKER_01;O le podemos llamar el Camero.
622.040;623.760;SPEAKER_00;Sin ningún sentido, además.
623.840;624.840;SPEAKER_01;Bueno...
625.640;627.040;SPEAKER_01;Hay que dar la propuesta.
627.120;628.760;SPEAKER_00;Me gusta porque... Claro.
628.800;629.960;SPEAKER_00;SF...
630.040;632.760;SPEAKER_00;Es que, claro, si fuese JR...
633.280;634.280;SPEAKER_00;O sea...
635.480;636.480;SPEAKER_00;JL...
636.840;638.160;SPEAKER_00;Pero SF...
638.680;641.080;SPEAKER_03;Habrá que preguntarle a John Cuesba.
641.160;644.080;SPEAKER_03;Porque luego John se saca algo así como el Gitano de Orio.
644.160;645.400;SPEAKER_03;Que nadie lo veía venir.
645.480;647.160;SPEAKER_00;Bueno, pero esto no fue John, eh.
647.240;650.120;SPEAKER_00;Esto fue Imanol en una rueda de prensa
650.200;652.600;SPEAKER_00;que dice que soy el Gitano de Orio.
652.680;654.160;SPEAKER_00;Me parece una maravilla.
654.520;656.080;SPEAKER_01;Y si pierde tres partidos seguidos,
656.120;659.280;SPEAKER_01;yo espero que de una entrevista despierta a Sergio Francisco, ¿no?
662.480;663.840;SPEAKER_00;Por eso hay que dejarle trabajar.
663.920;667.680;SPEAKER_00;Hay que dejarle trabajar y ya haremos nosotros lo nuestro.
667.760;668.840;SPEAKER_00;Corpas soldados.
668.920;671.120;SPEAKER_00;Siguiendo un poquito la cuestión de Michel,
671.200;673.680;SPEAKER_00;que también nos la lanzaba antes Óscar Álvarez,
674.880;676.360;SPEAKER_00;se mete en la situación del Sevilla.
676.440;680.720;SPEAKER_00;La ABC en Sevilla hablaba de Michel y de Bórdalas
680.800;682.720;SPEAKER_00;como futuros entrenadores del Sevilla.
683.480;685.480;SPEAKER_00;Agua y aceite, aceite y agua.
685.840;688.280;SPEAKER_00;Cenar una pizza y unas palomitas
688.360;691.960;SPEAKER_00;o una ensaladita de tomate y queso de Burgos, ¿vale?
692.480;694.840;SPEAKER_00;Creo que esto explica el contraste
694.920;697.320;SPEAKER_00;entre cómo siente el club la directiva
697.400;699.160;SPEAKER_00;y cómo lo siente Víctor Horta.
699.560;702.280;SPEAKER_00;Pero en todo caso, os quiero preguntar por esta opción.
702.760;703.920;SPEAKER_00;¿Qué os gustaría más?
704.200;705.440;SPEAKER_00;¿Qué os encaja más?
706.480;711.040;SPEAKER_00;Y qué significado puede tener una cosa u otra para la plantilla.
711.120;712.960;SPEAKER_00;Porque aquí Corpas Soldados también nos preguntaba
713.000;716.680;SPEAKER_00;por jugadores que ganarían o perderían de la mano de José Bórdalas.
718.320;720.760;SPEAKER_02;A ver, yo creo que el tema de Bórdalas...
721.680;724.800;SPEAKER_02;Me parece que creo que ninguna plantilla...
725.360;728.400;SPEAKER_02;O sea, que Bórdalas siempre va a ser capaz de sacarle algo,
728.720;729.800;SPEAKER_02;sea cual sea la plantilla.
729.880;732.560;SPEAKER_02;Es decir, creo que es un entrenador que tiene esa capacidad
732.640;735.560;SPEAKER_02;de ser camaleónico y de que su plan
735.800;737.600;SPEAKER_02;no se ciña tanto a los jugadores,
737.680;741.480;SPEAKER_02;sino directamente a lo que pueden dar sobre el terreno del juego.
741.560;742.560;SPEAKER_02;Dicho esto...
743.000;745.600;SPEAKER_00;Agumé, capitán general,
745.680;747.800;SPEAKER_00;e Isaac Romero como segunda punta, cuidado.
748.520;751.680;SPEAKER_02;Cuidado lo de Agumé como nueve, cuidado.
752.040;755.000;SPEAKER_02;Pero partiendo de esa base, obviamente...
756.040;758.560;SPEAKER_02;A mí me gusta mucho el fútbol de...
758.880;763.120;SPEAKER_02;O sea, cómo es capaz Bórdalas de sacarle rédito a plantillas
763.400;764.400;SPEAKER_02;que son muy flojas.
764.680;767.200;SPEAKER_02;Y yo creo que ahora mismo lo que necesita Sevilla es precisamente eso.
767.280;768.920;SPEAKER_02;O sea, primero un futbolista que se identifique...
769.000;771.240;SPEAKER_02;O un entrenador que se identifique con la afición,
771.280;774.280;SPEAKER_02;un entrenador que sea capaz de sacarle mucho rédito,
774.360;779.440;SPEAKER_02;de que además los jugadores sean capaces de rendir a un nivel muy alto.
779.520;781.160;SPEAKER_02;Yo creo que eso Bórdalas lo puede conseguir.
781.400;785.000;SPEAKER_02;Y sobre todo también un plan que se adecué más a lo que es el Sevilla históricamente.
785.160;786.160;SPEAKER_00;Es que, Nahuel,
786.800;789.720;SPEAKER_00;Mitchell no es García Pimienta
790.720;794.200;SPEAKER_00;porque Mitchell es muy capaz de conectar con la afición.
794.280;795.640;SPEAKER_00;Creo que tiene mucho carisma.
796.040;797.040;SPEAKER_00;Pero al final,
797.840;798.880;SPEAKER_00;Bórdalas es otra cosa.
798.960;800.160;SPEAKER_00;Creo que el sevillismo...
802.240;804.680;SPEAKER_00;El sevillismo se puede identificar mucho con Bórdalas.
804.760;807.880;SPEAKER_00;Y al mismo tiempo creo que Bórdalas necesita más a Sevilla que Mitchell,
807.960;811.080;SPEAKER_00;que yo no sé si tomaría la decisión de ir no por grandeza de club,
811.160;812.960;SPEAKER_00;que sería el mejor club en el castado Mitchell.
813.040;814.400;SPEAKER_00;Esto es así, pero de largo.
814.720;818.320;SPEAKER_00;Sino por la situación tan complicada que tienen en Nervión.
819.280;822.360;SPEAKER_01;A ver, por la parte de Mitchell, yo no sé hasta qué punto Mitchell
823.120;825.280;SPEAKER_01;puede elegir este tipo de cosas.
825.360;828.720;SPEAKER_01;Al final, las situaciones en los equipos grandes te llegan cuando te llegan.
828.760;830.720;SPEAKER_01;Y luego, en cuanto a la elección,
831.280;833.800;SPEAKER_01;percibo cierta unanimidad en torno a Bórdalas.
833.880;836.400;SPEAKER_01;Entonces, cuando tienes un entorno tan crispado,
836.480;838.120;SPEAKER_01;le tienes que dar a la gente lo que pide.
838.200;839.560;SPEAKER_01;Esto ya pasó en Valencia.
839.640;842.080;SPEAKER_01;Cuando se abre la ventana de,
842.160;846.960;SPEAKER_01;a ver, ¿qué hacemos después de la temporada tan horrible previa a Bórdalas?
847.040;849.000;SPEAKER_01;Dices, oye, Bórdalas de cajón.
850.120;851.840;SPEAKER_01;Entonces, yo no le daría muchas más vueltas
851.920;854.280;SPEAKER_01;si las condiciones son parecidas, que parece que sí,
854.360;856.240;SPEAKER_01;que ambos tienen contrato para la temporada que viene,
856.320;857.680;SPEAKER_01;que habría que negociar con Género,
857.680;859.480;SPEAKER_01;que habría que negociar con Getafe y Girona
859.560;861.640;SPEAKER_01;para pagar una recesión.
862.440;865.160;SPEAKER_03;Imaginaos a este tipo en un derbi sevillano.
865.640;866.720;SPEAKER_00;Habías ido a por eso.
867.320;869.880;SPEAKER_03;Había ido a por esto. A por la estampita, que la llevo en la cartera.
869.960;873.560;SPEAKER_03;He ido a por la cartera porque llevo la estampita.
873.640;876.160;SPEAKER_03;Siempre me protege de todo.
876.240;877.560;SPEAKER_01;A ver, yendo a la…
877.960;879.520;SPEAKER_01;Igual con más posibilidades económicas
879.600;882.840;SPEAKER_01;se puede repescar a otro de los apóstoles que ya no está en Getafe.
883.520;884.520;SPEAKER_00;Matías Olivera.
885.240;886.240;SPEAKER_01;Por ejemplo.
886.240;887.560;SPEAKER_01;La segunda avenida de Davidson.
887.640;889.320;SPEAKER_01;Pero recordemos que…
889.400;891.000;SPEAKER_01;El personal recuperado la nuestra. La nueve.
891.080;894.760;SPEAKER_00;Pero recordemos que si algo no tiene el Sevilla
894.840;896.320;SPEAKER_00;que ofrecerle a Bordalas…
897.560;899.120;SPEAKER_00;Son quita. Son perras.
899.200;900.200;SPEAKER_00;Es que claro…
900.280;901.800;SPEAKER_01;A ver, Davidson quiere decir…
902.200;903.200;SPEAKER_00;No, Davidson sí.
903.280;904.280;SPEAKER_00;… que pueden pedir por Davidson.
904.360;906.880;SPEAKER_00;No, ya, ya. Pero a lo que voy…
906.960;908.400;SPEAKER_00;Es verdad lo que dices, Nahuel,
908.480;911.280;SPEAKER_00;de que un club grande tú no eliges el momento, ¿no?
911.600;915.400;SPEAKER_00;Salvo quizás a un caso muy concreto, no eliges el momento.
915.640;916.640;SPEAKER_00;Creo…
916.720;918.760;SPEAKER_00;Chavy creo que lo eligió en cierta medida, ¿no?
918.840;920.840;SPEAKER_00;Cuando dice no primero, luego va…
920.920;922.520;SPEAKER_00;Bien, eso puede suceder.
923.600;925.240;SPEAKER_00;Chavy, no Xavi, por cierto.
925.320;926.320;SPEAKER_00;Pero…
926.400;928.120;SPEAKER_00;Xavi también está eligiendo bastante.
928.600;929.600;SPEAKER_00;Sí, puede ser.
929.680;931.160;SPEAKER_01;Le dice Karel Weyern, le dice no al Liverpool…
931.240;932.360;SPEAKER_00;Claro, pero…
932.440;935.120;SPEAKER_00;Pero claro, son ejemplos muy concretos y sobre todo…
936.040;939.200;SPEAKER_00;Algo que voy a decir es que no es que el Sevilla esté en una mala temporada.
939.280;942.000;SPEAKER_00;O sea, no estamos con el Sevilla
942.440;944.520;SPEAKER_00;después del OPT, ¿vale?
944.640;948.400;SPEAKER_00;Sino que estamos con un Sevilla en una crisis institucional gigantesca,
948.480;951.360;SPEAKER_00;con una crisis económica galopante,
951.440;953.400;SPEAKER_00;donde se le ha pedido a Horta,
953.480;955.160;SPEAKER_00;porque Horta lo ha explicado,
955.680;957.320;SPEAKER_00;y del Nido Carrasco,
957.400;959.480;SPEAKER_00;que no duda en contradecir a Horta
959.560;961.000;SPEAKER_00;cuando así lo creo oportuno,
