start_sec;end_sec;speaker;text
898.000;900.000;SPEAKER_03;¿Y el de Argentina?
900.000;902.000;SPEAKER_02;De Paul McAllister, Enzo.
902.000;904.000;SPEAKER_02;¿De Paul McAllister, Enzo?
906.000;908.000;SPEAKER_01;Me gusta.
908.000;911.000;SPEAKER_01;El de polco en Argentina es mucho mejor de lo que todos tenemos.
911.000;913.000;SPEAKER_01;Mucho mejor futbolista.
913.000;917.000;SPEAKER_00;A mí de Europa me parece mejor el de Países Bajos que el de Portugal.
917.000;921.000;SPEAKER_00;Claro, creo que también el contexto es más favorable
921.000;923.000;SPEAKER_00;en Países Bajos que en Portugal.
923.000;925.000;SPEAKER_00;Para que brillen, quiero decir.
925.000;928.000;SPEAKER_00;Porque Vitinha ¿en qué escenario le hemos visto brillar?
928.000;930.000;SPEAKER_00;En un país Saint-Germain súper dominante,
930.000;933.000;SPEAKER_00;un país Saint-Germain que tiene mucho balón, etc.
933.000;935.000;SPEAKER_00;En Portugal no le da eso.
935.000;939.000;SPEAKER_02;Si lo piensas, el Grabenberg de John Rangers
939.000;941.000;SPEAKER_02;es bastante complementario.
941.000;943.000;SPEAKER_02;Aquí vemos a un ranger más llegador.
943.000;947.000;SPEAKER_02;Ya lo vimos, por ejemplo, en la pasada Eurocopa.
947.000;949.000;SPEAKER_02;Pero...
949.000;951.000;SPEAKER_00;Qué gracia me hace como pronunciar rangers.
951.000;953.000;SPEAKER_00;Como si fuera un Power Ranger.
953.000;955.000;SPEAKER_00;Glasgow.
955.000;957.000;SPEAKER_00;Sí, sí, sí, lo pronuncio mal.
957.000;959.000;SPEAKER_02;Pero me parece muy complementario.
959.000;961.000;SPEAKER_02;Está bien tirado.
961.000;965.000;SPEAKER_03;Yo soy viudo del mejor centro del campo de la Uruguay de Bielsa.
965.000;968.000;SPEAKER_03;El Vendancur Valverde de Nico de la Cruz
968.000;971.000;SPEAKER_03;es un centro del campo para mirar los ojitos a cualquiera.
971.000;973.000;SPEAKER_03;Pero Nico tuvo problemas de lesiones.
973.000;977.000;SPEAKER_03;¿Puedes volver a repetir qué centro del campo
977.000;979.000;SPEAKER_02;mira los ojitos a cualquiera?
979.000;981.000;SPEAKER_02;No, no.
981.000;984.000;SPEAKER_03;El Vendancur Valverde de Nico de la Cruz mira los ojos a cualquiera.
984.000;986.000;SPEAKER_03;Te lo defiendo contra quien quieras.
986.000;987.000;SPEAKER_03;Y de Arrasca.
987.000;989.000;SPEAKER_03;De Arrasca no puedes sustituir a la Cruz.
989.000;991.000;SPEAKER_00;Es que está jugando bastante más arriba.
991.000;994.000;SPEAKER_03;Está jugando bastante más de nueve ahora en Flamengo.
994.000;997.000;SPEAKER_03;Y nunca ha terminado de caer de pie.
997.000;999.000;SPEAKER_03;Aunque teníamos partidos con la selección.
999.000;1001.000;SPEAKER_03;Ha entrado a jugarte por Nico de la Cruz,
1001.000;1003.000;SPEAKER_03;que creo que le da un poco más de consistencia,
1003.000;1005.000;SPEAKER_03;pero le quita un poco de brillantez.
1005.000;1010.000;SPEAKER_03;En fin, que soy viudo de ese centro del campo hace dos años.
1010.000;1012.000;SPEAKER_03;Quería que ibas a ser viudo del Ruso Pérez,
1012.000;1014.000;SPEAKER_02;Arevalo Ríos,
1014.000;1015.000;SPEAKER_02;Gargano.
1015.000;1017.000;SPEAKER_02;Gargano, Gargano.
1017.000;1019.000;SPEAKER_02;Gargano, Gargano.
1019.000;1021.000;SPEAKER_03;El centro del campo era la hostia.
1021.000;1023.000;SPEAKER_02;Bueno, pero Gargano no jugaba tanto con ellos.
1023.000;1025.000;SPEAKER_02;Juega con el Tata.
1025.000;1027.000;SPEAKER_03;El Tata González.
1027.000;1029.000;SPEAKER_02;El Tata González.
1029.000;1031.000;SPEAKER_03;El Tata, el Tata.
1031.000;1035.000;SPEAKER_02;Era un buen jugador, pero parecía mejor cuando estaba Egidio,
1035.000;1037.000;SPEAKER_02;estaba Ruso Pérez y decías Tata.
1037.000;1039.000;SPEAKER_02;Le decías coño, es Recova.
1039.000;1041.000;SPEAKER_02;No, pero claro, al lado de mis primos...
1041.000;1043.000;SPEAKER_02;El Tata.
1043.000;1045.000;SPEAKER_02;El Tata que era...
1045.000;1047.000;SPEAKER_02;Tata, Tata, Tata, Tata, Tata, Tata.
1047.000;1049.000;SPEAKER_02;Tata, Tata, Tata, Tata, Tata.
1053.000;1055.000;SPEAKER_02;No hay que reírle las gracias.
1055.000;1057.000;SPEAKER_02;Esto lo estoy aprendiendo con Hugo.
1057.000;1060.000;SPEAKER_02;Porque a veces valía y no hay que reírle las gracias porque...
1060.000;1062.000;SPEAKER_00;Me refiero a esto, es que no me ha salido bien el ritmo.
1062.000;1064.000;SPEAKER_00;¿Puedo enseñar?
1064.000;1068.000;SPEAKER_02;A ver, si pones una música, nos cancelan el vídeo.
1068.000;1072.000;SPEAKER_02;Entonces, encima de haberte escuchado, encima nos cobramos.
1072.000;1073.000;SPEAKER_00;No, no.
1073.000;1075.000;SPEAKER_00;No, que no cobre él.
1075.000;1077.000;SPEAKER_00;A ver...
1077.000;1079.000;SPEAKER_00;A ver...
1079.000;1081.000;SPEAKER_03;Es que no lo voy a encontrar.
1081.000;1083.000;SPEAKER_03;No le pagues a Dejano tu porcentaje de los tringues.
1083.000;1086.000;SPEAKER_00;Me dejas que lo vaya buscando y seguís y ahora os lo pongo.
1086.000;1088.000;SPEAKER_02;Te deje o no, lo vas a hacer, así que...
1088.000;1090.000;SPEAKER_02;Tampoco hace falta, Álex.
1090.000;1092.000;SPEAKER_00;Sí que es muy gracioso.
1092.000;1095.000;SPEAKER_00;Hay barcos que pasan y está bien que pasen.
1095.000;1097.000;SPEAKER_00;Pues ya está, ya igual, que pase.
1097.000;1099.000;SPEAKER_00;Cuarta cuestión.
1099.000;1101.000;SPEAKER_02;¿Sabéis de quién?
1101.000;1103.000;SPEAKER_02;Fer Pulpillo.
1103.000;1105.000;SPEAKER_02;¡Hombre, Fer Pulpillo!
1105.000;1108.000;SPEAKER_02;Fer Pulpillo es una ametralladora, deja 5 o 6 cuestiones.
1108.000;1111.000;SPEAKER_02;Y ahí el reto es quedarte solo con una, le hacen muy buenas preguntas.
1111.000;1114.000;SPEAKER_02;Y hace una, Álex, que...
1114.000;1118.000;SPEAKER_02;Venimos hablando más off the record que otra cosa, porque no hemos tocado exactamente el tema.
1118.000;1123.000;SPEAKER_02;Pero pregunta Fer, ¿es Birch, por ahora, la gran decepción del fútbol europeo?
1123.000;1125.000;SPEAKER_02;Yo creo que la respuesta es sí.
1125.000;1127.000;SPEAKER_02;La cuestión es, ¿qué está pasando?
1127.000;1134.000;SPEAKER_00;Yo creo que se va a mover en la gran decepción del fútbol europeo, básicamente, primero, por obviamente lo que se pagó por él.
1134.000;1136.000;SPEAKER_00;O sea, es que eso va a ser... va a estar...
1136.000;1142.000;SPEAKER_00;Si hubiera empezado la temporada con 5 goles, 5 asistencias, no estaríamos diciendo nada a esto, por ejemplo.
1142.000;1145.000;SPEAKER_00;Pero tan pesimista eres, ¿no crees que va a remontar el vuelo?
1145.000;1147.000;SPEAKER_00;O sea, yo creo que puede remontarlo, por supuesto.
1147.000;1153.000;SPEAKER_00;Pero es que me da la sensación de que Slot y él están en dos sintonías diferentes, ¿sabes?
1154.000;1157.000;SPEAKER_03;Entonces es lo que quieres decir.
1159.000;1162.000;SPEAKER_00;Sí, pues está Steven Gerrard ahí esperando, ¿no? A ver si se da.
1162.000;1169.000;SPEAKER_00;No, pero mi sensación es que Birch quiere jugar en el rol por fuera que tiene influencia por dentro
1169.000;1174.000;SPEAKER_00;y le está metiendo en una posición muy fija, que es la de la media punta del Liverpool,
1174.000;1179.000;SPEAKER_00;en la que él, yo creo que no termina de estar cómodo, en la que cuando le hemos visto su mejor partido con el Liverpool,
1179.000;1186.000;SPEAKER_00;yo te diría que es la segunda parte ante el Arsenal, que es en la que se suelta más, baja a recibir, se lateraliza un poco...
1186.000;1188.000;SPEAKER_00;En definitiva entra más en contacto con el balón.
1188.000;1193.000;SPEAKER_00;Y yo sinceramente pensaba que iba a ser ese el rol, porque además si una fortaleza tuvo Liverpool el año pasado,
1193.000;1197.000;SPEAKER_00;es que el centro del campo de tres le funcionó muy bien.
1197.000;1202.000;SPEAKER_00;Con Graben Birch Macalister tiene una versión impresionante, con Soboslai que ahora lo está ubicando en lateral
1202.000;1206.000;SPEAKER_00;y que eso también obviamente, pues al equipo a veces se lo hace notar.
1206.000;1207.000;SPEAKER_00;Y en definitiva te diría que sí.
1207.000;1213.000;SPEAKER_02;Es curioso lo que dices, porque hablas de que la posición le está complicando un poco...
1213.000;1215.000;SPEAKER_02;Jesús, no...
1215.000;1216.000;SPEAKER_02;Le está complicando...
1216.000;1219.000;SPEAKER_02;Hattrick, Hattrick, se lleva el balón a casa...
1221.000;1225.000;SPEAKER_02;Habla... Decías que va de dentro hacia afuera y que es un poco incómodo,
1225.000;1230.000;SPEAKER_02;en Alemania está jugando demasiado por fuera, o sea, y demasiado lejos de dónde está la pelota.
1230.000;1234.000;SPEAKER_02;En Alemania, el otro día estuve viendo el partido contra Irlanda del Norte, que creo que ya lo he comentado alguna vez,
1235.000;1237.000;SPEAKER_02;que juega Kimmich en el lado derecho.
1237.000;1243.000;SPEAKER_02;Entonces, aunque Kimmich no sea centrocampista, el balón va a ir a Kimmich, porque es un jugador que organiza,
1243.000;1244.000;SPEAKER_02;aunque sea desde el lateral.
1244.000;1248.000;SPEAKER_02;Entonces claro, tienes a Birch como extremo del lado débil.
1248.000;1252.000;SPEAKER_02;Te dices, coño, es que es rarísimo. Y estuvo muy mal, el partido fue muy malo.
1252.000;1254.000;SPEAKER_01;Es muy raro, es evidente.
1254.000;1260.000;SPEAKER_01;Y seguramente ni Slot en el Liverpool ni Nagelsmann en Alemania estén entendiendo
1260.000;1265.000;SPEAKER_01;que deben dar a Birch para que luzca, pero si no funciona con el club y tampoco con la selección,
1265.000;1270.000;SPEAKER_01;es porque él no está bien. Es decir, es un futbolista que ya lo demostraba en el Leverkusen,
1270.000;1276.000;SPEAKER_01;se movía muy bien en distintas zonas y en el espacio reducido era un jugador que era una baldosa...
1276.000;1281.000;SPEAKER_02;Pero no puede tener Birch un poco el tema, por compararle,
1281.000;1283.000;SPEAKER_02;porque siempre hemos hablado de Birch, Musiala y Bellingham.
1283.000;1288.000;SPEAKER_02;Un poco lo que le puede pasar a Bellingham, de no saber exactamente...
1288.000;1290.000;SPEAKER_00;De su hueco, ¿no? De encontrar su hueco.
1290.000;1293.000;SPEAKER_02;De su hueco y de qué habilidades explotar.
1293.000;1297.000;SPEAKER_02;Quiero decir, porque creo que son jugadores, y esto también pasaría con Musiala,
1297.000;1300.000;SPEAKER_02;pero son jugadores que pueden hacer muchas cosas y ser muchas cosas,
1300.000;1304.000;SPEAKER_02;pero ¿cuál eliges y cuál necesitas como equipo?
1304.000;1307.000;SPEAKER_02;Porque a veces igual no va de la mano, no sé si me explico.
1307.000;1311.000;SPEAKER_02;Igual el Real Madrid necesita al Bellingham más llegador, pero Bellingham es mejor en otras cosas.
1311.000;1316.000;SPEAKER_02;Igual el Liverpool necesita a Birch entre líneas, pero Birch entre líneas puede ser un buen jugador,
1316.000;1319.000;SPEAKER_02;pero no es el mismo futbolista con esa capacidad para moverse.
1319.000;1327.000;SPEAKER_02;Creo que era el único jugador del sistema de Alonso que había mucho intercambio posicional y mucho movimiento.
1327.000;1330.000;SPEAKER_02;Pero el que tenía libertad para decidir era Birch.
1330.000;1334.000;SPEAKER_02;Era el que se podía saltar las cosas. Y yo no le estoy viendo eso en el Liverpool.
1334.000;1336.000;SPEAKER_00;Claro, a mí esto por ejemplo...
1336.000;1342.000;SPEAKER_00;Tú sabes, Miguel, que yo tuve que hacer una vez un ejercicio de cómo adaptar Florian Birch al Arsenal.
1342.000;1343.000;SPEAKER_00;Lo hablamos.
1343.000;1348.000;SPEAKER_00;Ahí había que adaptar al lateral que tenías en ese lado a quien tenías en el otro sector
1348.000;1352.000;SPEAKER_00;y sobre todo cómo eran los interiores para que no se pisaran la misma zona además del 9.
1352.000;1357.000;SPEAKER_00;Obviamente si tú te ciñes en lo más estadístico dices, coño,
1357.000;1364.000;SPEAKER_00;si Florian Birch es tener como una radiografía de Martín Odegaard, pero en lugar de en el sector derecho, digamos, en el izquierdo.
1364.000;1369.000;SPEAKER_00;Pero es que esto no funciona así. Desgraciadamente el futbol no es como en el FIFA o en el fútbol de maestro que lo pones y chau.
1369.000;1373.000;SPEAKER_00;Aquí tienes que encajar demasiadas situaciones además también de cosas personales.
1373.000;1381.000;SPEAKER_00;Yo, una de las cosas que sí que he alucinado un poco es que en The Athletic preguntaron a gente, a representantes,
1381.000;1387.000;SPEAKER_00;oye, ¿cuál creéis que va a ser la decepción o el fichaje de decepción de esta temporada?
1387.000;1393.000;SPEAKER_00;Y le ponía a todo el mundo votación. Creo que la votación era todos los votos a Sesco por el Manchester United.
1393.000;1396.000;SPEAKER_00;Y creo que un representante había votado a Birch y otro a Isaac.
1396.000;1399.000;SPEAKER_00;O sea que eran como 20 representantes ya.
1399.000;1403.000;SPEAKER_02;El tema del Manchester United es tiro a tablero también.
1403.000;1406.000;SPEAKER_02;El tema con Birch era joven.
1406.000;1414.000;SPEAKER_03;Es claramente, quitando a Salah, que es una leyenda del club, es el mejor jugador del equipo.
1414.000;1419.000;SPEAKER_03;Entonces yo creo que viene a Liverpool a hacer por adaptarse a él, igual que Alemania.
1419.000;1424.000;SPEAKER_00;Y le está pasando con Salah. Yo creo que también le está pasando con Salah.
1424.000;1429.000;SPEAKER_00;Aunque como Salah no está tan bien, creo que eso está haciendo que Birch no esté tan bien.
1429.000;1434.000;SPEAKER_00;Porque Birch está generando. Creo que lleva generadas como tres o cuatro ocasiones claras.
1434.000;1439.000;SPEAKER_02;Pero genera está jugando mal. Birch es tan bueno, por eso cuesta tanto.
1439.000;1442.000;SPEAKER_02;Que incluso estando mal es un jugador que te va a producir.
1442.000;1445.000;SPEAKER_03;Pero de nuevo, temporadas son larguísimas.
1445.000;1450.000;SPEAKER_03;A estas alturas de la pasada temporada, Mbappé parecía a Izan Mbappé.
1450.000;1452.000;SPEAKER_03;Ya le gustaría.
1452.000;1455.000;SPEAKER_01;Qué golazo metió el otro día al PSG.
1455.000;1459.000;SPEAKER_00;Lo celebró Killing, lo celebró Kiki.
1459.000;1460.000;SPEAKER_00;Ah sí?
1460.000;1461.000;SPEAKER_03;Claro, claro.
1461.000;1463.000;SPEAKER_02;Está en la grada.
1463.000;1467.000;SPEAKER_03;Entonces, calma. Esto de que Gagpo vaya a sentar a Florian Birch...
1467.000;1468.000;SPEAKER_03;No, eso no.
1468.000;1474.000;SPEAKER_00;No, eso no. Pero que digo que lo más lógico sería ver a Birch en la posición de Gagpo.
1474.000;1475.000;SPEAKER_00;Sí, sí.
1475.000;1484.000;SPEAKER_02;Es que a mí Gagpo, siendo un jugador que me gusta, estamos hablando de un escalón sencilla y inferior al resto.
1484.000;1487.000;SPEAKER_02;De hecho, yo no hubiese...
1487.000;1491.000;SPEAKER_02;Supongo que porque no tenías la misma oferta, la misma gestión y demás, por supuesto.
1491.000;1494.000;SPEAKER_02;Pero si tú puedes elegir, yo me quedo con Luis Díaz y no con Gagpo.
1494.000;1495.000;SPEAKER_03;No me lo has afacido.
1495.000;1498.000;SPEAKER_02;No, pero es un debate que he leído en Twitter muchas veces.
1498.000;1503.000;SPEAKER_00;No, es que Slot, Slot yo creo que no tengo esa duda. Slot dijo, mira, llevamos a Luis Díaz.
1503.000;1504.000;SPEAKER_02;Es verdad que...
1504.000;1507.000;SPEAKER_00;Yo creo que a Slot no le terminaba de molar Luis Díaz demasiado.
1507.000;1512.000;SPEAKER_02;Luis tiene pinta de haber sido un poco intenso a nivel del día a día.
1512.000;1513.000;SPEAKER_00;O flamenco.
1513.000;1514.000;SPEAKER_00;Por lo que...
1514.000;1518.000;SPEAKER_03;No será Slot un poquito de la cuerda de Bangal.
1518.000;1522.000;SPEAKER_03;No sé quién declaró el otro día aquello de que no soportaba a los sudamericanos.
1522.000;1525.000;SPEAKER_02;Bangal, claro. Se movían los sudamericanos por lo que sea.
1525.000;1527.000;SPEAKER_02;Riquelme, Rivaldo...
1527.000;1530.000;SPEAKER_03;No recuerdo quién es la declaración, lo encontraré.
1530.000;1533.000;SPEAKER_02;Riquelme dice bastante gracia y tiene un respaldo.
1533.000;1535.000;SPEAKER_02;Sí, sí, sí, sí, no, no.
1536.000;1537.000;SPEAKER_02;María Falcao...
1537.000;1542.000;SPEAKER_02;No, no, la forma de entender el fútbol del jugador sudamericano, mucho más relacionista,
1542.000;1544.000;SPEAKER_02;por ejemplo ahora lo estamos viendo con Argentina, pero en general,
1544.000;1548.000;SPEAKER_02;eso que se conocía como la nuestra en Argentina y sigue ahí,
1549.000;1553.000;SPEAKER_02;no, no, no, con el fútbol de Luis Bangal no funciona.
1553.000;1554.000;SPEAKER_02;No cuadra.
1554.000;1557.000;SPEAKER_00;Oye, Riquelme, puedes asistir dos goles, marcar uno y tal,
1557.000;1560.000;SPEAKER_00;pero si te he dicho que estés en la banda, estate en la banda.
1560.000;1565.000;SPEAKER_02;Pero lo mejor, yo me leí la biografía de Bangal que además no se publicó en castellano,
1565.000;1569.000;SPEAKER_02;entonces me la tuve que leer en inglés y ya sabéis que mi inglés, pues Alan Piz.
1569.000;1573.000;SPEAKER_02;Tuve que hacer un ejercicio mastodóntico.
1573.000;1578.000;SPEAKER_02;El caso cuenta Bangal en esa autobiografía, creo que no es autobiografía, pero bueno,
1578.000;1583.000;SPEAKER_02;me entendéis, que él aprende que no puede encasillar los talentos,
1583.000;1590.000;SPEAKER_02;en el AZ, después de todo de que había fracasado, en el AZ con el Handawe y ahora se me ha olvidado
1590.000;1594.000;SPEAKER_02;quién era el otro delantero, pero en el AZ que creo que sale campeón,
1594.000;1598.000;SPEAKER_02;dice por fin he entendido que hay que hacer excepciones y dices cabrón,
1598.000;1602.000;SPEAKER_02;este Arribaldo, Riquelme, y lo entiendo.
1602.000;1607.000;SPEAKER_02;Muy de Luis Bangal, por cierto, como persona y como profesional.
1607.000;1608.000;SPEAKER_02;Y como libreta.
1608.000;1611.000;SPEAKER_02;Y como libreta, pero es verdad que un poquito tal.
1612.000;1615.000;SPEAKER_02;Con Ale, pasemos ya a la Liga, ¿vale?
1615.000;1619.000;SPEAKER_02;¿Creéis que Corberán sobrevivirá a la trituradora de entradores de Méridon?
1619.000;1622.000;SPEAKER_02;Parece que se le ha caído el equipo en el riguroso octubre,
1622.000;1625.000;SPEAKER_02;¿podrá realzarlo encima Calendario Chungo?
1625.000;1628.000;SPEAKER_02;Este es un tema que habíamos dejado abierto,
1628.000;1632.000;SPEAKER_02;Valencia no salvó a Pau Novich en ese partido, pero...
1632.000;1636.000;SPEAKER_00;Vais a flipar quién era el otro delantero de la AZ.
1636.000;1638.000;SPEAKER_00;Dembele, el Dembele del Tottenham.
1638.000;1641.000;SPEAKER_02;Sí, el Dembele del Tottenham, que luego es centrocampista.
1641.000;1643.000;SPEAKER_02;Es Musa Dembele, ¿no?
1643.000;1645.000;SPEAKER_02;Musa con Aésea, ¿no?
1645.000;1648.000;SPEAKER_02;¿Qué creéis que va a pasar con el Valencia?
1648.000;1654.000;SPEAKER_02;Porque en este calendario que hace que los primeros meses sean como escalones
1654.000;1659.000;SPEAKER_02;o como etapas, la primera etapa, bueno, la segunda dices, eh,
1659.000;1664.000;SPEAKER_02;y ya la tercera se puede torcer, yo no sé si irremediablemente, pero ya...
1664.000;1666.000;SPEAKER_02;Sí, sí.
1667.000;1669.000;SPEAKER_00;Yo creo que le da la vuelta, eh.
1669.000;1671.000;SPEAKER_01;A la Vestilla Real, Madrid-Betis, eh.
1671.000;1675.000;SPEAKER_01;Sí, Belka, Calendario es complicado, pero yo creo que lo saca.
1675.000;1680.000;SPEAKER_01;El otro día nos contaba en la pizarra Luis Cortés la información que publicaba
1680.000;1684.000;SPEAKER_01;Diego Pico en marca, que Corberán convocó a los capitanes en su despacho
1684.000;1689.000;SPEAKER_01;45 minutos para hablar con ellos, para calmar un poco la situación,
1689.000;1692.000;SPEAKER_01;para reconducir un poco la dinámica, y creo que lo saca.
1692.000;1695.000;SPEAKER_01;Creo que lo saca. Me parece buen entrenador y que puede darle la vuelta.
1695.000;1700.000;SPEAKER_03;Pues yo, como os he comentado, mi teoría más allá del análisis,
1700.000;1703.000;SPEAKER_03;creo que es acertado, que el equipo no está bien, que no encuentra sensaciones,
1703.000;1706.000;SPEAKER_03;que ha desconectado mucho con la grada, yo creo que eso lo vemos todos.
1706.000;1709.000;SPEAKER_03;Es que Corberán es su propio jefe.
1709.000;1713.000;SPEAKER_03;Es que Corberán manda fichar a Ron Gurley, que es el que le ficha en su día
1713.000;1715.000;SPEAKER_03;para el West Brom.
1715.000;1720.000;SPEAKER_03;Creo que debería darse una situación irreconducible dentro del mal calendario
1720.000;1722.000;SPEAKER_03;que tiene el Valencia al final.
1722.000;1726.000;SPEAKER_03;Sales a Mendizorroza, que tampoco es la última mazmorra,
1726.000;1729.000;SPEAKER_03;y luego de los siguientes cuatro partidos hay tres en casa,
1729.000;1732.000;SPEAKER_03;que son Villarreal, Betis y Levante.
1732.000;1735.000;SPEAKER_03;No me parece el peor de los calendarios tampoco.
1735.000;1739.000;SPEAKER_03;Creo que con muy poquito más este Valencia puede cambiar.
1739.000;1745.000;SPEAKER_03;Y ya digo, sobre todo, creo que Corberán debería estar en descenso
1745.000;1748.000;SPEAKER_03;faltando cinco jornadas para acabar la liga, para ser destituido.
1748.000;1751.000;SPEAKER_03;Creo que ya es el entrenador al que han puesto para...
1751.000;1755.000;SPEAKER_03;Oye, que me gestionen esto entre Ron Gurley y Corberán
1755.000;1757.000;SPEAKER_03;y que hagan lo que puedan.
1757.000;1758.000;SPEAKER_03;Que no molesten mucho.
1758.000;1760.000;SPEAKER_03;Que no molesten mucho y ya está.
1760.000;1763.000;SPEAKER_03;La gente se les una con Europa y no se ha colmado esa expectativa.
1763.000;1767.000;SPEAKER_03;Igual este parón, esta mala racha, sirve un poco para recalcular objetivos.
1767.000;1771.000;SPEAKER_03;Insisto, yo no veo al Valencia sufriendo ni a Corberán cerca de la picota.
1771.000;1775.000;SPEAKER_00;No, o sea, yo de la picota no, pero creo que este escalón,
1775.000;1778.000;SPEAKER_00;llamémoslo así, es muy complejo.
1778.000;1779.000;SPEAKER_00;Pero muy complejo.
1779.000;1782.000;SPEAKER_00;Y a nivel de juego creo que tiene que cambiar mucho las cosas.
1782.000;1785.000;SPEAKER_00;A la vez es fuera o en casa?
1785.000;1786.000;SPEAKER_02;A la vez es fuera.
1786.000;1789.000;SPEAKER_00;Es que fuera son el Bernabéu y Mendizorroza.
1789.000;1791.000;SPEAKER_00;En casa es Villarreal y Betis.
1791.000;1792.000;SPEAKER_00;Cuidado, eh.
1792.000;1796.000;SPEAKER_00;Claro, es que me parecen cuatro partidos que perfectamente...
1796.000;1800.000;SPEAKER_00;O sea, yo puedo comprar lo que dice Nahuel de la...
1800.000;1801.000;SPEAKER_02;de esa teoría.
1801.000;1804.000;SPEAKER_02;Me parece que tiene mucho sentido y es un puntito cínica,
1804.000;1807.000;SPEAKER_02;pero es que es así como hay que actuar con mérito ni complejo.
1807.000;1808.000;SPEAKER_02;Con mérito ni compañía.
1808.000;1811.000;SPEAKER_02;Pero claro, imagínate, vamos a ponernos en un mal escenario.
1811.000;1813.000;SPEAKER_02;Sé que es fútbol ficción, pero te ponés en un mal escenario
1813.000;1814.000;SPEAKER_02;que puede llegar a ser probable.
1814.000;1818.000;SPEAKER_02;De estos 12 puntos posibles, vamos a decir que sacas dos, ¿vale?
1818.000;1821.000;SPEAKER_02;Que tampoco es un disparate, joder, no es un disparate.
1821.000;1825.000;SPEAKER_02;Claro, de repente te ves en una situación en la tabla,
1825.000;1827.000;SPEAKER_02;decepcionante respecto a esas expectativas quizás,
1827.000;1829.000;SPEAKER_02;algo exagerada, ya lo comentamos en su día en verano,
1829.000;1831.000;SPEAKER_02;que se habían hecho con los fichajes,
1831.000;1834.000;SPEAKER_02;notas a algún jugador incómodo, otro rebrincado,
1834.000;1836.000;SPEAKER_02;qué pasa con Raba, qué pasa con el otro,
1836.000;1840.000;SPEAKER_02;Gallac que ya ha tenido algún momento de llegar a no parecer
1840.000;1843.000;SPEAKER_02;intocable para lo que es incluso la afición y dices,
1843.000;1845.000;SPEAKER_02;ostia, que se me comienza a complicar.
1845.000;1848.000;SPEAKER_02;Entonces yo no creo que en esa situación ni siquiera en esa
1848.000;1849.000;SPEAKER_02;situación fueras a ser destituido,
1849.000;1852.000;SPEAKER_02;pero sí que comienzas a acercarte a una situación sin retorno
1852.000;1855.000;SPEAKER_02;y la situación sin retorno, más tarde o más temprano,
1855.000;1856.000;SPEAKER_02;se solucionan de la misma manera.
1856.000;1859.000;SPEAKER_00;Sí, porque no tienen retorno, básicamente,
1859.000;1862.000;SPEAKER_00;como su propio nombre indica, ¿no, Miguel?
1862.000;1865.000;SPEAKER_00;Pero sí que a mí no me parece que sea un...
1865.000;1868.000;SPEAKER_00;o sea, yo creo que al Valencia están muy lejos ahora mismo,
1868.000;1872.000;SPEAKER_00;yo creo que quizá a la vez le puedes meter un poquito más y demás.
1872.000;1874.000;SPEAKER_00;Me han dicho roza cuidado, ¿eh?
1874.000;1876.000;SPEAKER_00;Sí, me han dicho roza cuidado, pero bueno,
1876.000;1879.000;SPEAKER_00;me parecería un partido que el Valencia podría sacar adelante,
1879.000;1881.000;SPEAKER_00;podría sacar un empate, pongámoslo así,
1881.000;1884.000;SPEAKER_00;pero es que los otros tres me parecen súper complejos.
1884.000;1886.000;SPEAKER_00;Pero al Valencia se le complican todos,
1886.000;1889.000;SPEAKER_03;pero los otros tres, por ejemplo, el del Betis en casa lo gana,
1889.000;1891.000;SPEAKER_03;el del Bernabéu la temporada pasada lo gana,
1891.000;1893.000;SPEAKER_03;el Villarreal empata en casa también la pasada temporada,
1893.000;1894.000;SPEAKER_03;quiero decir.
1894.000;1896.000;SPEAKER_00;Pero creo que el Bernabéu el año pasado
