start_sec;end_sec;speaker;text
0.000;7.520;MIGUEL;Ya os avisamos que los viernes va a seguir habiendo Q&A aunque haya acabado la temporada 24-25 o más
7.520;12.040;MIGUEL;o menos porque tenemos mundial de clubes, ya hablaremos del mundial suficiente la próxima
12.040;16.880;MIGUEL;semana pero hoy este Q&A se va a centrar sobre todo en el mercado de fichajes.
16.880;31.100;MIGUEL;Te pasa pizarritas ya estamos aquí los de siempre y como siempre de forma variadita y
31.100;35.600;MIGUEL;picadita Adrián Blanco, Alex de Llano, Nahuel Miranda, ¿cómo estáis chicos? ¿Qué tal chicos?
35.600;43.560;MIGUEL;¿Cómo estamos? ¿Qué tal? Muy buenas. Muy buena Cami, la de Adrián Blanco, el cual por cierto viene
43.560;51.320;MIGUEL;siendo cada vez más elogiado por la creciente distancia entre un hombro y otro. Sí, sí, ya
51.320;57.800;ALEX;hay cuatro euros de carrera de taxi que diría Alberto de Yogo, hay todavía seis euro. Ya hay
57.800;64.080;MIGUEL;gente que se está empezando a plantearse cosas, que se está haciendo preguntas, preguntas para
64.080;70.720;ADRIAN;los que quizás no tiene respuestas. Bueno, oye, abierto. ¿Hay algo ilegal ahí? ¿Hay algo ilegal?
70.880;79.400;ADRIAN;No, de momento no. De momento no. Me gusta porque dice de momento. La cosa tira hacia adelante. No,
79.400;84.720;NAHUEL;no, siempre natis, chicos, siempre natis. ¿Cómo que natis? ¿Puedo pegar ya el primer palo? Sí,
84.720;92.560;NAHUEL;por favor. Creo que es de las peores camisetas del Levante que yo he visto. Sí, bueno. A todo
92.560;98.640;ADRIAN;peor el Levante, pero es una camiseta cuestionable. Bueno, activamos el... A parte de Adrián Blanco,
98.800;105.320;NAHUEL;así de grande, así de fuerte, parece Nikola Vuksevich. Sí, sí, sí. Te vas a trabajar, eh.
105.320;115.640;MIGUEL;Activamos el contador de suegreos, van uno. A ver dónde acabamos. La media es prometedora. A mí me
115.640;122.120;MIGUEL;mola, eh, porque siempre las camisetas del Levante me molan. El toquecito granota y no tan azulgrana
122.120;127.360;MIGUEL;como Eibar Barca creo que queda muy bien con ese tipo de azulgrana. A ver, a mí me amaba porque el
127.680;133.280;ADRIAN;Levante abrió su outlet y me tocó bien. No, no. Adiós. Adiós. Lo peor que te puede pasar.
136.600;143.280;NAHUEL;Esto es lo peor que te puede pasar. Jaque mate. No me lo puedo creer, tío. No me lo puedo creer.
143.280;150.240;NAHUEL;Bueno. Vamos a apañar esto como se puede. Además es que... Cago en diez, encima está lleno de polvos.
150.240;160.560;ALEX;Las hierbitas del mate son aputadas, eh. Ay, qué putada. Se cuela por todos lados. La alfombrilla
160.560;168.200;MIGUEL;está para limpiarla después. Nada, nada. Yo... Bueno, estaba diciendo... Sí, sí. No, pero no sé si empezar
168.200;174.920;MIGUEL;o aflitarte mientras... A ver, puedes hacer dos cosas a la vez. Yo sé que te cuesta un poco eso,
174.920;181.080;MIGUEL;Miguel, que es un reto profesional, pero... Tengo mi cámara aquí, ¿vale? Y os tengo vosotros ahí.
181.080;188.440;NAHUEL;Entonces... Vale. Todavía... Mira, deja de mirarme un segundo y me tiran de la primera pregunta y
188.440;196.400;MIGUEL;la tengo por texto, ¿eh? Me parece, me parece de bien. José BJ17 pregunta si creemos que la
196.400;203.000;MIGUEL;flexibilidad de las normas del fairplay va a propiciar que más equipos tengan más posibilidades
203.000;208.040;MIGUEL;de retener a sus jugadores clave. Recordamos que la liga ha cambiado alguna que otra cosita,
208.040;214.320;MIGUEL;ha matizado alguna que otra norma, ha flexibilizado en resumen algún que otro criterio referido,
214.320;220.920;MIGUEL;por ejemplo, a establecer un límite mínimo del 30% de la cifra de negocio, que a veces veíamos
220.920;225.480;MIGUEL;alguna cifra rarísima, por ejemplo, del Sevilla, que dices que no tiene sentido, entonces lo han
225.480;234.360;MIGUEL;dejado en 30%. Luego ha establecido algo que se llama... ¿Hadón Salto, no? No he entendido,
234.360;239.280;NAHUEL;no he entendido, pero bueno... Vas a ver un mensaje que había petado la cámara y he tenido que
239.280;244.240;NAHUEL;refrescar. Vale, vale, vale. No quería explicarlo, quería que pasara de puntillas, pero bueno, ya que
244.240;249.920;NAHUEL;nos paramos de nuevo, esto está siendo muy complicado, ¿eh? Luego la liga ha creado algo que se
249.920;254.520;MIGUEL;llaman como fichajes a cámara lenta, en el sentido de que permite inscribir a futbolistas con la
254.520;263.360;MIGUEL;garantía de que luego, durante el año, se cree ese espacio salarial para realizar esa inscripción.
263.360;267.800;MIGUEL;Y luego, por último, también la liga, y esto me parece importante porque quizás va referida a la
267.800;273.880;MIGUEL;pregunta de José, la liga también ha reflexibilizado las reglas para renovar a jugadores menores de 24
273.880;281.400;MIGUEL;años, incluso si el club no tiene espacio salarial, sino está en el 1-1. Es decir, que con esto los
281.400;288.240;MIGUEL;clubes van a tener más facilidad para negociar según qué fichajes y también según qué renovaciones.
288.240;294.160;MIGUEL;¿Cuánto va a permitir a los clubes retener su talento? Hombre, no creo que vaya a cambiar una
294.160;300.160;MIGUEL;barbaridad, pero sí que es verdad, Zadri, que así quizás muchos clubes dejan de tener una posición
300.160;305.320;MIGUEL;perdedora en el mercado. Esto es lo que veníamos criticando. No es que el límite salarial no fuese
305.320;309.960;MIGUEL;justo, que eso, oye, son los criterios que establecen entre todos, los aprueba la liga, la liga son los
309.960;315.360;MIGUEL;clubes, bien, parante, pero si solo la liga se establece con ese límite salarial y el resto de
315.360;321.400;MIGUEL;ligas hacen un poquito, la mayoría, lo que les da la gana, pues deja en una posición, insisto, de
321.400;327.520;MIGUEL;indefensión al fútbol español cuando luego acude al mercado común. Absolutamente, yo creo que dentro
327.520;333.480;ADRIAN;de un control, que esto no se vuelva a alocar y los clubes se vuelvan a hundir dentro de las deudas
333.480;337.560;ADRIAN;con la ciencia de la seguridad social, yo creo que en todo un control, creo que los cuatro somos
337.560;341.560;ADRIAN;partidarios de que hay que flexibilizar un poquito la norma y que hay que tratar de ser un poquito
341.560;346.400;ADRIAN;más creativos, un poquito más flexibles para dar un poquito más de margen en el mercado, es que si
346.400;350.720;ADRIAN;no, del contrario, estamos viendo que cada vez que se abre el mercado de fichajes España se estaba
350.720;358.520;ALEX;convirtiendo en un mercadillo. Es inevitable que venga un Brighton de turno, un Chelsea,
358.520;364.120;ALEX;eso va a seguir pasando y se lo va a llevar. A veces que cobran de media cobran 100 kilos más que los equipos
364.120;370.040;MIGUEL;españoles por los derechos. Y la masa salarial muchas veces, por ejemplo, hace que esa cláusula de
370.040;375.120;MIGUEL;los jugadores, de los jóvenes talentos, no pueda ser todo lo que le gustaría, no se trata de poner
375.120;380.240;MIGUEL;venga 100 millones de cláusulas, este joven talento que tengo aquí, tiene que ir acorde al salario.
380.240;386.440;MIGUEL;Yo recuerdo a varios clubes hablar del modelo, no sé si me equivoco, el modelo alemán que
386.440;392.200;MIGUEL;hacía esto en trienios, a la hora de calcular el tema del límite salarial o se hacía que los
392.200;397.720;MIGUEL;clubes tuviesen cierto margen para tener un año quizás de ciertas pérdidas e inversión, pero que
397.720;405.920;MIGUEL;en tres años se compensase. Creo que hay que controlar... Esto no era tanto el límite salarial,
405.920;410.920;NAHUEL;sino que a la hora de hacer el reparto de los derechos de televisión se tenía en cuenta como
410.920;416.800;NAHUEL;el ranking de UEFA en las últimas cinco temporadas, que por eso fue por lo que el Leipzig tardó tanto
416.800;421.800;NAHUEL;en poder estar a nivel de gasto de los más grandes en Alemania. No podía hacerlo nada más subir a
421.800;429.360;NAHUEL;un desliga. Luego lo que hace Alemania es con cada club hacer una auditoría todas las temporadas y
429.360;435.840;NAHUEL;decide si le entrega la licencia o no, que fue noticia porque con el Schalke 04 hubo alguna
435.840;441.080;NAHUEL;temporada donde en segunda división estaba complicado. Bueno vamos a ver qué impacto tiene,
441.080;447.800;MIGUEL;pero sí que es verdad que se han flexibilizado ciertas normas en ese sentido y que creo que puede
447.800;452.280;MIGUEL;ayudar al fútbol español a que en el mercado de fichajes oye se maneje de una mejor manera.
452.280;459.600;MIGUEL;Fran J. Benitez 10 pregunta a Les De Llano por la posición que debe priorizar el Sevilla en
459.600;466.080;MIGUEL;este mercado y aclara, si no lo teníamos claro nosotros, estamos flojos en todas. Hay que tener
466.080;469.480;MIGUEL;en cuenta que está a puntito de llegar cordón. Nosotros estamos hablando de esto el miércoles
469.480;474.320;MIGUEL;4 de junio 12 y cuarto, ya se ha anunciado la marcha de Víctor Horta. No sabemos exactamente
474.320;481.160;MIGUEL;qué va a pasar con el entrenador, pero llegue cordón o no, llegue algo así o no,
481.160;487.200;MIGUEL;llegue quien llegue. Alex, la plantilla es muy justita. La plantilla es justita. Obviamente yo
487.200;493.680;ALEX;creo que a la gente el cuerpo le pedirá gol, le pedirá un tipo que yo se las tire y las marque.
493.680;498.720;ALEX;Que me parece que Sol Sevilla no lo ha tenido esta temporada, ha tenido Luque Bakio, pero al margen
498.720;503.400;ALEX;de eso, que habrá que ver si se termina quedando o no, que termina corriendo con su situación.
504.600;512.720;ALEX;A mí si el entrenador es un estilo Imanol, pongamos que no es Imanol, pero se busca de ese estilo. A
512.720;517.800;ALEX;mí ese equipo me parece que le falta un centro van pista de juego, o sea un pivote, pero aquí
517.800;523.600;ALEX;a Lima. Yo te diría que esas son las que yo veo que podrían preocupar un poquito más. También entiendo
523.600;528.680;ALEX;que se irá a Bade o que tiene muchas posibilidades de irse y ahí ya necesitas un central. Yo creo
528.680;534.080;ALEX;que es un equipo que necesita muchísimas, pero yo te diría que para mí la prioridad sería en esas tres.
534.080;541.440;NAHUEL;Yo te acuerdo con eso. Todas, todas, todas no hay que reforzar. Extremos no.
542.760;551.000;NAHUEL;A mí la defensa me gusta. Bueno, dentro del contexto. Hay que ver qué pasa con Kike Salas,
551.000;557.520;MIGUEL;hay que ver qué pasa con Loic y Bade, pero sí que es verdad que el tema del 9 me parece prioritario.
557.520;562.360;MIGUEL;Es verdad que venimos de ver a Imanol Aguacil en la Real Sociedad no potenciar a los 9, pero no sabemos
562.360;568.280;MIGUEL;qué es Imanol Aguacil fuera de la Real Sociedad. A mí lo del 9 me parece prioritario incluso por
568.280;575.000;MIGUEL;encima del centro van pista. Yo creo que Agumé ha hecho un buen final de temporada y a mí es un
575.000;579.920;MIGUEL;jugador que creo que hay que mantenerlo, que creo que está bien, pero hay que acompañarlo de un
579.920;583.720;MIGUEL;jugador con buen pie. Esas serían las dos prioridades básicas, pero si tengo que poner,
583.920;590.800;MIGUEL;si tengo 10 millones por hacerlo muy simplón. Adri, pongo 7 en el delantero y 3 en el centro
590.800;596.440;MIGUEL;campista porque además el delantero va a ser más caro que el centro campista aunque tenga un nivel
596.440;601.800;ADRIAN;más o menos parecido. Sí, es verdad que con Imanol hemos visto la doble punta, pero a mí me gustaría
601.800;607.600;ADRIAN;ver una inversión de un 9 que pueda jugar con Isaac Romero para así, oye, igual matas dos pájaros
607.600;612.680;ADRIAN;un tiro. Tienes un delantero que te haga los goles y un futbolista que potencia a su vez a Isaac Romero
612.680;617.800;MIGUEL;como hacía en el sirio. Lo vimos alguna vez con Sorro C. Isaac, yo recuerdo un día en el
617.800;625.160;MIGUEL;metropolitano de Sorro C. Isaac, pero vamos, contadas ocasiones. Sí, a ver, yo, esto lo hemos hablado ya
625.160;629.600;ADRIAN;cuando estaba un Víctor Horta en el Cargua, a Sevilla le va a tocar ser muy creativo en el
629.600;636.280;ADRIAN;mercado de fichajes, igual sería buena idea, seguro que lo estudiara Cordón, buscar sesiones
636.280;641.880;ADRIAN;tipo Fabio Silvano en Deportivo a las Palmas. Es decir, yo voy a intentar pescar en futbolistas
641.880;645.720;ADRIAN;que estén un poquito venidos a menos o jugadores jóvenes que traten de encontrar la oportunidad
645.720;652.840;ADRIAN;buscar ese tipo de operaciones a las que sí puede acceder el Sevilla y no compras. Y a Core Adams
652.840;662.760;ALEX;no nos tiene que demostrar más, no? Es que ha jugado a poco. Cuatro partidos, no? Hay que decir que Horta intentó esa
662.760;669.320;NAHUEL;vía la que comenta. Has usado la pregunta pero tenías la respuesta preparada. Ha apuntado a Adri la vía de
669.320;673.760;MIGUEL;la cesión de esos jugadores talentosos que además el Sevilla tiene mucho mercado, mucho más que la
673.760;679.560;MIGUEL;mayoría de equipos que suelen pedir sesiones. Realmente lo intentó con Aníbal Meirri, salió muy mal
679.560;688.680;NAHUEL;desde la primera semana y Loconga... Con Marco, con Beliz, uno del español de esta temporada.
688.680;694.440;MIGUEL;A mí me ha parecido que no ha funcionado ninguno, salvo a Goume que creo que empieza cedido y luego
694.440;702.320;MIGUEL;termina fichado pero es verdad, Nau, que es un tipo de refuerzo que necesita sobre todo en términos de
702.320;708.560;MIGUEL;calidad neta, ¿sabes? Porque a lo que menos acceso va a tener el Sevilla ahora mismo es a calidad neta
708.560;712.600;MIGUEL;pura y dura salvo que haya oportunidades de mercado como el de Vargas que a mí me parece que es un
712.600;719.880;MIGUEL;fichaje de momento y que salió muy bien. A ver, el tema con ese tipo de cesiones es que si yo soy el
719.880;725.120;NAHUEL;Manchester United, soy el Chelsea, soy el Tottenham, soy el PSG, igual quiero mandar a
725.120;731.600;NAHUEL;jugar a un entorno más tranquilo, a un perfil más girona por ejemplo o en otro nivel lo que hace el
731.600;737.520;NAHUEL;Mirandes en segunda división que no meternos en Sevilla, es que en Sevilla ya con el horno que no está
737.520;744.520;NAHUEL;para bollos pues Meirri a los 20 minutos aterrizando en Sevilla ya estaba con la cruz puesta, es que no
744.520;750.040;NAHUEL;tiene tiempo de crecer entonces yo creo que eso es complicado, el Sevilla ya lo está haciendo,
750.040;755.560;NAHUEL;pues eso, ha fichado del United, ha fichado del Tottenham, ha fichado del Arsenal, ya se está
755.560;760.040;NAHUEL;moviendo en ese sentido, fichó del Inter en el caso de Agumé pero la mayoría de ese tipo de
760.040;764.080;NAHUEL;apuestas no la han salido porque al final son jugadores que están por hacer y lo que te pide
764.080;769.080;NAHUEL;la situación es un jugador un poquito más resolutivo, un poquito más hecho a veces. Lo intentó con
769.080;777.040;MIGUEL;Aledio Comadri también. Sí, pero bueno, complicado, complicado, igual es un triple que había que
777.040;785.800;MIGUEL;tirar pero es un triple que no ha entrado, la pizarra de Bo, ¿vale? Bo, de Bo. Bo, Bo, Bo, Bo,
785.800;791.720;NAHUEL;¿os acordáis de ese dibujo? Bo, Bo, por el poder del cabello nasal. Claro, claro, claro, que tiraba con los pelos de la nariz.
791.720;799.960;MIGUEL;No, no, no, no lo vi, no lo vi. Mercado Villarreal, Mercado Villarreal, Alex, tenéis que elegir,
799.960;804.040;MIGUEL;vale, es una especie de papá-mamá pero en este caso con desarrollo de mercados fichajes,
804.040;811.000;MIGUEL;tenéis que elegir entre fichar a un central por si se va a Foyx el año que viene buscando el futuro
811.000;816.160;MIGUEL;de la posición o un medio centro para buscar el nuevo medio centro posicional para cubrir ya la
816.160;823.320;MIGUEL;futura marcha de Dani Parejo. ¿Por dónde lo tirarías tú, Alex? Yo por el medio centro,
823.320;830.040;ALEX;creo que el tema del central se puede solucionar más con lo que hay, más la cantera, pero el
830.040;835.680;ALEX;medio centro sí que veo que la figura de Parejo probablemente sea más difícil de llenar con
835.680;841.800;ALEX;alguien que ya esté en plantilla o con alguien de la casa. Yo tiraría por el medio centro. Yo creo
842.480;847.240;ADRIAN;que también. Yo creo que también tiraría por el medio centro, que no tiene que ser un medio centro
847.240;851.840;ADRIAN;único que juegue por delante de la defensa, porque sabemos que Marcelino habitualmente juega con el
851.840;855.680;ADRIAN;4-4-2 y tiene que ser una pieza que encaje en el doble pivote, así que yo buscaría un centro
855.680;861.880;ADRIAN;campista que tenga criterio con balón y que pueda hacer ese relevo que ya está empezando el Villarreal
861.880;869.240;NAHUEL;con Parejo. A ver, la información de los compañeros del delegado y de Javi Mata es que
869.240;874.480;NAHUEL;Marcelino cuenta con que Foyt siga. Ya en una entrevista reciente se la tira ahí un poco para
874.480;879.520;NAHUEL;decirle que queremos que seas un jugador, que seas un pilar de este equipo en los próximos años.
881.080;886.880;NAHUEL;Entonces yo me despreocuparía un poco en ese sentido y centraría los esfuerzos en el tema del
886.880;890.960;NAHUEL;medio centro, que ya el propio Marcelino dice que Parejo es de los mejores jugadores que yo he
890.960;894.920;NAHUEL;entrenado, pero lo tenemos que dosificar y más una temporada con Champions. De hecho, Nao, es que
894.920;900.280;MIGUEL;te diría que tú la apuesta por los centrales ya la has hecho. Que los bancos de Cambuela no nos
900.280;904.960;MIGUEL;han encantado la primera temporada, no nos han encantado la primera temporada y hay dudas
904.960;910.200;MIGUEL;legítimas con los dos de diferente tipo, pero bueno tienes que proteger tu inversión y tienes
910.200;915.120;MIGUEL;que darle tiempo y esto es algo que el Villarreal sabe hacer muy bien. Y Pauna Barro, me imagino que
915.120;921.600;ALEX;tendrá relevancia si ocurre ese escenario que nos dibujan. Lo de Pauna Barro es sobre todo lo que
921.600;928.040;NAHUEL;es el lateral. Habrá levas de central? Sí, yo creo que sí. Yo creo que en la posición de Kiko
928.040;932.800;NAHUEL;Femenia, que es otro de sus jugadores que va a dejar hueco. Y que termina siendo central a la hora
932.800;937.160;MIGUEL;de salir, porque es verdad que defienden 4-4-2 el Villarreal, pero ataca con tres desde atrás,
937.160;942.640;MIGUEL;como siempre explicamos. Hablaban por cierto de Cuenca, es del Villarreal, también del Barcelona,
942.640;947.240;MIGUEL;cantenado de la Masía. Que el Rayo estaba interesado, porque en el full-on no había tenido
947.240;955.120;MIGUEL;mucho impacto. Sería interesante esto, pero lo que iba a comentar es que has hecho esa apuesta,
955.120;960.840;MIGUEL;la tienes que proteger, la tienes que cuidar. La cuestión es, en el centro del campo necesitas
960.840;965.520;MIGUEL;alguien posicional. Eso creo que lo tenemos claro, porque tienes a Kome Sanya y a Puppet Gate, a los
965.520;972.000;MIGUEL;que les gusta más volar. Son jugadores diferentes, pero les gusta tener recorrido. Estamos fijándonos
972.000;977.280;MIGUEL;en el perfil parejo, es decir, un jugador posicional de un pie super dotado. Para mí,
977.280;980.720;MIGUEL;Dani Parejo cuando sonó para el Barça de Valverde podía haber fichado por el Barça de Valverde
980.720;985.560;MIGUEL;perfectamente. Estamos hablando del centro del campo del Barça. Igual, Marseíno, con la inseguridad
985.560;991.520;MIGUEL;defensiva que ha llegado a tener su equipo, piensa en un jugador posicional, pero quizás de un corte
991.520;997.880;MIGUEL;diferente. Lo digo sobre todo porque ¿cuántos Dani Parejos hay? Muy poquitos. Sin embargo,
997.880;1005.880;NAHUEL;si hay alguien que pueda acceder, es el Villarreal, que al final te vas a jugar a la corte en el 26.
1005.880;1013.800;NAHUEL;Hay futbolistas como Rabiot, el que ya tuvo en Olímpico de Marsella. Ese perfil de futbolista
1013.800;1023.280;NAHUEL;de hoy… Genduzki. Se molaría. Algo así. A mí me encajaría un Antonio Blanco, por ejemplo.
1023.840;1032.160;NAHUEL;Mousi. Enzo Barrenechea para mí es un gran fichaje para Villarreal. Es que tienes opciones.
1032.160;1038.760;MIGUEL;No me parece un mercado reducido. Claro, pero Barrenechea no es otro parejo. Es un jugador
1038.760;1043.960;MIGUEL;posicional de otro perfil. Claro, pero yo me voy a eso, que es un jugador que tiene que guardar la
1043.960;1050.000;NAHUEL;posición. Dani Parejo la guarda. Seguramente te hagan falta dos incluso. Sí, seguramente sí.
1050.240;1058.360;NAHUEL;Y si quieres a un parejo, a sus 27 años, Rodrigo Bentancur… Chicos, el que ahí lo saqué del
1058.360;1065.760;ALEX;trotteramo. El heredero de Guren. Hubiera sido gracioso porque el Villarreal en la cantera tenía
1065.760;1071.280;ALEX;un jugador que acaba contrato, si no me equivoco, que se llama Rodri Alonso, que es como de los grandes
1071.280;1076.160;ALEX;medioscentros de España. A uno le coges el nombre y al otro la apellido. En Nación Vadía, ¿no?
1076.160;1087.560;MIGUEL;Rodri Alonso, Pereira García. Es una combinación parecida. Cuarta cuestión, Albert Cazorla. Esta
1087.560;1094.160;MIGUEL;te ha gustado a ti, Adri, porque te he visto un montajito en Twitter. ¿Podría Jadon Sancho ser
1094.160;1103.200;ADRIAN;el nuevo Anthony? Por favor, ojalá. Ojalá sea así. Me encantaría que lo fuese. Oportunidad de
1103.200;1109.040;ADRIAN;futbolista por el cual el Chelsea está pagando para no quedárselo, que me parece tremendo.
1109.040;1120.040;NAHUEL;Brutal. Si tiene mucho de clickbait lo de pagar para no quedárselo. No paga un fío. No te quieres
1120.040;1123.840;NAHUEL;quedar a los jugadores, que no le quieres pagar lo que le paga el United. Son 250 mil por semana.
1123.840;1131.800;NAHUEL;Estás dispuesto a pagar con tal de no hacer eso. No, es que te sale más barato. Claro,
1131.800;1139.080;NAHUEL;es que pensémoslo así. 250 mil por semana es un millón al mes. Son cinco meses de contrato,
1139.080;1146.080;MIGUEL;realmente. Es curioso, pero a mí me parece que Jadon Sancho ya tiene que dar ese paso. Es el
1146.080;1153.800;MIGUEL;pasito atrás, Alex. Yo creo que con el Dortmund ya lo dio. No sabría decir que es el Chelsea en
1153.800;1158.640;MIGUEL;este momento en el escalafón europeo, pero Betis, equipo de Europa League, equipo que juega bien,
1158.640;1166.280;MIGUEL;equipo que te puede permitir reencontrarte contigo mismo. Yo creo que a veces los jugadores se pierden.
1166.280;1177.600;NAHUEL;Mira, contador de estornudos. Lo que te decía Alex, que hay veces que el jugador se pierde y
1177.600;1182.360;MIGUEL;que necesita volver a reencontrarse y volver a reencontrar su pasión por el fútbol. Yo creo
1182.360;1186.440;MIGUEL;que esto es lo que le ha pasado a Anthony. Es verdad que Anthony desde el primer día llega con
1186.440;1191.160;MIGUEL;esa mentalidad. Quiero darle mérito también al chico, no solo a Pellegrini, no solo a Betis,
1191.160;1196.040;MIGUEL;no solo a la ciudad, a la afición. Quiero dar mérito al chico, pero es que aunque no hubiese llegado
1196.040;1201.640;MIGUEL;con esa mentalidad, como que el Betis te empuja a ello. Y yo creo que Jadon Sancho necesita eso
1201.640;1208.360;ALEX;para luego si acaso volver a dar un paso adelante. Sí, de hecho ya hubo un tiempo atrás en el que
1208.360;1217.840;ALEX;Jadon Sancho dejó de jugar con el Manchester United para hacer una pausa, hacer un momento
1217.840;1223.800;ALEX;de reset anivemental. Es verdad. Supuestamente Den Haag le ayudó, le dio unos contactos en Países
1223.800;1229.480;ALEX;Bajos para que fuera a entrenar allí, entrenara en diversas sedes. O fue como los contactos en Países
1229.480;1234.920;ALEX;Bajos para ir a relajarte. Sí, sí, sí. Cuando lo ha dicho… Yo cuando lo he dicho pensé que me iba
1234.920;1240.600;ALEX;a decir, joder, le podría haber llevado a Dubai, que entrenara con buen tiempo, a Marbella,
1240.600;1244.520;ALEX;a tal, a no sé qué, pero le llevó a… No, no, no, a Países Bajos. Pues yo que sé, en Países Bajos.
1244.520;1249.680;NAHUEL;Que no es lo mismo los Países Bajos que los Países Bajoneros. No sé, serán los tulipanes quizás,
1249.680;1262.160;ALEX;no? Era en Brabante, perdón, no, en el OJC Rosmallen. ¿Qué? Tócate, ¿eh? OJC Rosmallen.
1262.160;1267.560;ALEX;¿Pero qué? En las instalaciones de ese club. Ah, vale. Ah, vale, claro, es que, joder, das un nombre
1267.560;1274.960;ALEX;al puto Azahar. No, que eran las instalaciones de ese club en Brabante. El coffee shop en el que
1274.960;1282.960;ALEX;estuviste en Ámsterdam, Alex. No, no, no. Es que era como la clave del wifi, tú. Sí, OJC Rosmallen,
1282.960;1289.480;ALEX;Voetbal, un equipo amateur de Países Bajos. Vale, vale. Entonces, ¿ves lo del Betis? Bueno, sí,
1289.480;1296.440;ALEX;que lo veo y además me encajaría que si hubiera interés del Real Betis, que todavía me imagino
1296.440;1302.720;ALEX;que no, pero bueno, a ver cómo se da el mercado. Antonio diría, niño, Sevilla, ni te lo pienses.
1303.320;1311.520;ALEX;Sevilla, pero igual en el verdiblanco mejor, porque en el otro están ahí como, no, está ahí todo muy
1311.520;1316.480;ALEX;movido, igual ahí no te relajas, pero en el Betis con Pelegrini y tal sí que está. Aunque,
1317.720;1323.640;ALEX;mi gran pedrada, chicos, mi gran pedrada, porque yo creo que esto ya sería confirmar el nivel de
1323.640;1330.840;ALEX;resurrección del Betis, es Rahim Sterling. Ostras, hombre, a ver, creo que eso hay que
